text,author,likes,replyCount
"According to Calley, MAHA is most deeply concerned with children's health.  If this is true then the majic juice would, of necessity, be a priority concern for this organization.  Why? There is a 22% increase in child endings at this time.  This increase coincides with the introduction of child juice.  If this were purely a matter of food these ending would not have occured.  Thank you for airing this important discussion.",@JillBerkana,2,0
1:54:16  Calley and Jack should collaborate on a new book about pharmaceuticals and the deep state.,@tkz1977,0,0
"Means reminds me of Vivek, another Big Pharma narcissist. 🙄",@curiousbrowza,2,0
"In the first 15 minutes Means monopolised the exchange.  He evaded every question as he framed his own.  Jack is right; he is just following his training.  They are told which questions to evade and how and where to leapfrog from there.  Means is a canned package of processed infos.  Summary: it is not just processed foods that poison but also process infos which is a form of mental poisoning. 🧐😡🤬EDIT: I am very, very put off by Means constantly using the terms ""dark"", ""menacing"", ""angry"", ""not positive"" et al.  All of these are used to paint an opposer as being bad which works in concert with the indoctrination and programmings that he is aware the people have been exposed to.  First impression?  This guy is obviously a wicked narcissist and trained Marxist.  I can't stand him! 😡😠🤬",@curiousbrowza,5,1
I just watched a lady who said it affects the pancreas too.  In the First 20 minutes of raynoths show on rumble about a week ago.  Pod cast with 4 people.  Starts w one guy.,@Lizzylongtoes,0,0
Always follow the money.,@richspizzaparty,1,0
Means are straight out of the UN playbook. Globalist much? Lobbyist? Yes. https://pmc.ncbi.nlm.nih.gov/articles/PMC10261019/,@clarkmobley5398,0,0
A high priority on LIBERTY means a low priority on everything else....,@faza553,0,0
He wants to use all the right verbiage doesn't he.  Say safe amd effective you monster!!!,@Lizzylongtoes,0,0
This lad with the black hair is a gut maggot.. can’t answer simple yes no questions … dancing around them like some politician .. rat …,@stephen7724,1,0
Alpha Santa Vs soylent lobbyist,@dockoyotill5442,0,0
"I love this guy ( Santa, not the brain washed elf)",@melissafutreal466,1,0
YouTube is censoring comments here big time,@JadeBuchanan-o7e,0,0
"Why is Calley constantly being accused of wierd vague shit? Being born to a privileged family a crime now?I would have walked out way early, this is not an interrogation, it is a podcast.If one side is not asking Qs in good faith f em.Wierd thing is, they agree on most stuff, just disagree on implementation details. Good luck going against pharma corpo lobbisyts. They wont be disorganized.",@osk9,0,0
Hard to listen to. Calley doesn’t seem authentic.,@hump717,1,0
On the other hand… Calley could just be ignorant of the reality of the people he surrounded himself with. Very difficult to accept for him to acknowledge that he is being used by the devil (no other way to put it). We are fighting each other when the devil is the guiding all this for humanity’s destruction.,@zuzannabaranski,0,0
"Like watching a guilty worm squirm. Diverting and using all the tactics possible to avoid the truth and fire. He was expecting a nice warm light and got the blowtorch. hahahahaha Well done Jack and Danny. I hope this is cause for a real spiritual shake of for you Calley. Go home and question who you are, what you're doing and your role in this cosmos. Come to the light mate. The truth will set you free.",@joewolvey5837,0,0
calley seems like the biggest plant i have ever seen 🌳,@shaunzaghet4381,0,0
Calley is acting like somebody has a video of him with a kid on an island somewhere.,@ksquatch7519,3,0
"America is the island the land of the lawyer, the land of the loophole, this lobbyist just goes to show how when one is selective and quote"" deliberately delicate with their word choice, One could essentially dance around the seriousness of any topic or issue and walk away on the moral high ground. What is happening is despicable and faith in a Kennedy or a trunk to do anything is just absurd to me to think that anyone would even believe in a fairy tale thought like that",@Gr8_illuminanc3,0,0
I love the way that Kelly slipped in at 2 hours 35 minutes The bio weapon line,@Gr8_illuminanc3,0,0
Calley is a straight-up bullshitter.Why does Danny let him talk about nothing?He keeps cutting Jack off when he gets close to the truth.,@cedricward-i3p,0,0
Sorry but Jack made himself look bad. Despite his sometimes valid points he absolutely was bad faith in how he approached this conversation. You can’t tell me that if you all sat across from someone coming out the gate ready to skewer you that you wouldn’t sidestep too. Everyone saying Calley is dishonest based upon him maintaining his composure is being dishonest themselves.,@PeekAchoo95,2,8
CALLEY IS A SNAKE. He is intertwined with the most evil elites.,@FuccYew,0,0
Public Relations = PROPAGANDA,@FuccYew,0,0
I wanted to watch this because Jack was on it.But I can't stand the others who just blather and interrupt.,@cedricward-i3p,0,0
That woman keeps interrupting. Love Jack. He knows the truth.Glad he called Danny out.,@cedricward-i3p,0,1
"I don’t understand the sentiment… Dr. J is still trying to fight yesterday‘s Covid battle. I found him as insincere as many apparently think Calley was (what’s worse, a shock jock or a lobbyist?). Dr jack acted like a jerk and you don’t win someone over to your side by talking about their dead mom.",@brahmafear3212,0,0
"Calley is a piece of garbage, a fraud, a grifter, a world economic form stooge. People need to be put in jail for life for crimes against humanity !!!!!!!",@johnsuder7671,0,0
"He has mentioned manny times that he is trying to talk from that heart. He shouldn't say that if it was true because if he did, we should recognize it. But he's delayed on answer and 💯 bs. When he does not want to give an answer, he acts like he does not know.",@RobertoMartinez-k4y,3,0
That Calley guy is very disrespectful he needs to relax and answer questions if not just say you don’t want to answer be honest.,@Rio_MilsGrebeci,0,0
Calley doesn't not answer a direct question when Jack ask. Because he gains time by delays the answer to not make mistakes on the answer. He his a total fraud and does not care about any of Americans health issue. But I would say that Jack his risking he life to unfold the truth. Jack is a hero.,@RobertoMartinez-k4y,1,0
Calley is looking like Flint Dibble with the Kruse missle aimed his direction,@yourpalnate,0,0
"All Calley can come back with is 'like, like, like, like, ad infinitum.' Terrible to listen to. A laborious, torturous 3 hrs of a wimpy, winey, wishy-washy, apologist for the people who've put up with him to achieve their political ends. A product of MKULTRA but doesn't know it. No political future for the guy, especially not with MAGA or MAHA. He's a RINO at best, but not with the balls or required treachery involved. A DemocRat? Yes he'd make a good supplicant DemocRat full of platitudes, dot point narrative.  A weak, low energy, gut-less person who DOES NOT represent MAGA-MAHA in any way. MAGA people will be appalled that he has influence on Trump, the transition team, RFKjr or MAHA. A deep state supplicant. A mealy mouthed social climber, a career lobbyist (liar). How he's made it this far up the ladder is mystifying, but it seems pretty clear that he has powerful background support from what is (from a MAGA-MAHA perspective) a nefarious and questionable background. Like Obumma had. Glad Kruse was there to counter his pre-planned narrative, and had done some research on him that was telling. Calley wasn't sure what Kruse would ambush him with next. All he had was a wordy expression of zero that the average MAGA supporter wants to hear. He's a testosterone free zone. Yes, he talks a lot of crap with little substance. An entitled brat with Ivy school degrees, no brains or any meaningful life experience. Zero. A soy boy. Interesting watching him squirm as he was asked simple questions that he wouldn't answer. True MAGA people come out and say it out loud, blunt and clear. Backed up with facts, data, evidence or sound experience and spoken forcefully with confidence. This guy's got nothing.  He's not MAGA. he's a mouse. He's in it for himself. If MAGA people saw this episode they'd be worried. Calley can't listen to words of experience. He simply doesn't get what Jack Kruse says. and Kruse has a warm and wonderful way of speaking, with authority. Calley has zero of that. He doesn't listen to questions, his mind is racing trying to find words to put together an evasive and in his head, believable non-answer. Anyone who can't answer a straight simple closed question with either a Yes or a No answer cannot be trusted. Period. Trump has to jettison this liability before he has any real influence. G",@grahamjxxx8535,0,0
"This is almost impossible to listen to. I can't vouch for Calley, i dont know him. But Jack did not come to have a conversation of any type. Just personal attacks that ruin his own credibility even though his information may be spot on.",@nate1sam,0,0
I keep thinking they're saying c*mshot and it changes the conversation dramatically,@juiceboxheart,0,1
"Imagine/recall yourself trying to persuade your family & friends on the issue: how far did you get before people disengage or worse, turn on you? Because Calley has experience in politics, he knows an issue has to be guided through with baby steps to get any result. It's clear to everyone who's been paying attention to how tings are done in DC. Screaming from the rooftop is morally right but it gets you canceled fast and your mission squashed, unless you're in the majority, which won't happen for a while.  Calley believes his approach has a better chance to achieve the goal, considering what we're facing, and he has a point, however infuriating the circumstances may be. Btw, screaming from the rooftops absolutely needs to continue, as well as trying to reach & educate as many people as possible, so that get the majority. Both Jack & Calley are needed in this battle, and I wish they joined forces and worked out a clever strategy to hit the problem on two flanks.",@davyd28,0,0
I and my husband do not trust the medical industry.  We avoid contact.  I'm afraid the trust is gone for good.  It's too late.,@SandraBegotka,0,0
"The most annoying thing about this D stick is him repeating, jack, jack, jack. It’s condescending and weak. Especially because he doesn’t say anything and skirts any threatening discourse. This guy is greasy.",@Adambombgallerie,1,0
I have watched this twice now. You guys may want to go look at Tucker Carlson pod cast with this brother and sister and connect the dots he has lied many times!,@GrayHat0621,0,1
You. Are. On. The. Same. Team. Stop it. Fucking A. Don’t let little differences rip you apart. This is ridiculous.,@matthewmarkle,0,1
My story is…,@GenuineSounz,0,0
This was just a bunch of crazy antivaxers bullying a guy who just wants to virtue signal and gain power. I really hope these people don't get a hold of Trump's ear.,@wesdiezy,0,1
"I believe that a lot was achieved during these deliberations, heated as they were at times. Thank you all for the fight you are fighting on behalf of all those who were misled by the propaganda from 2020/2021 onwards, and the genuine doctors and health professionals who have lost their reputations, and careers, and have suffered these hate campaigns because of raising awareness.",@chessnelson1177,0,0
"Wow , this guy will not say yes or no . They really must go to school to learn to never commit to an answer . An answer so obvious:(",@75ENVY,0,0
Calley reminds me of Jamey Dutton from Yellowstone😂,@bitoiwork1965,1,0
Anybody pushing the jab and trying to sell their book rather than answering the question we shouldn't trust I agree with Jack,@trailerminer9650,3,0
"Kind of see why Dr Kruse is having so much trouble getting attention and convincing people of anything. Being an asshole is a relatively easy sport, you don't get attention by being good at it. What an insufferable quack.",@BorislavIordanov,0,0
"This is such a great example of you see what you want to see. I’m sorry, I don’t know how someone listens to this and comes away thinking jack kruse dunked on Calley. I probably agree with everything Jack says on paper but all I heard was calley constantly being interrupted and never being able to express a full thought. All while Jack was just raising his voice and yelling.",@timlist1178,0,0
"Difficult to listen with those incessant, constant, repetitive words being used . Too bad those cudnt be edited out... just saying The rest was great!!!",@jennyhopemclaren9396,0,0
"I think Jack is right......lobbyist can not be trusted. Ban the MNRA vaccine 💉 and get the poison out of our water, Air,, food.",@AliciaBarnett-hl8ck,1,0
"The lobbyist is nauseating...did he and Gavin Newsom have the same MK speech teacher...""Jack is an educated man, hero and badass.",@LoreDenham,2,0
I will never 👎 use vaccines or use the medical institute. The Devil is real and he runs the world.,@AliciaBarnett-hl8ck,2,0
"Every time he said “Jack, Jack, Jack” I pictured the ineffectual mayor from “Nightmare Before Christmas”",@lindacovello7823,0,1
"Great podcast, more people need to see this. Crazy that there's only 7,500 likes.",@islandpapa1024,1,0
LOL BRO YOU LOOK REALLY GOOD FOR NOT SLEEPING.,@GrayHat0621,0,0
Jack has revealed this man Calley!,@barbaradebernardo5779,3,0
Jesus mother of Joseph!!  Just when we thought it was over we just landed right back into the swamp !!,@GrayHat0621,1,0
"I think when you put health into the conversation and your personal goal behinds paying off school debt, getting rich. You automatically go to the dark side. I think Dr. Jack and this awesome lady who is a ENT has the perfect approach",@GrayHat0621,0,0
Actions>Words,@righteous247,0,0
@dannyjones should you ask for people to protest on this shit?   I mean I’m being honest here seriously you can take this comment down if you want but I think people should be standing at Washington’s door right now,@GrayHat0621,0,0
1:33:46 well Wef CALLED ME... 😂😂😂,@nikolafrleta4609,1,0
"Great interview, Danny! After hearing this podcast and the first one you did with Uncle Jack, I subscribed to your channel! Thanks for letting this extremely important topic come out. When the jabs came out, even before I studied up on the jab, I heard loudly in my soul! DON'T TAKE THIS!! Of course, afterward, I studied with various doctors like Dr. McCullough, etc. I watched the roundtable with Senator Ron Johnson, with doctors, scientists, patients, and representatives of close ones that died!!  Among many other studies that included world statistics!   I knew when""covid"" and  this jab came out.The world would never be the same! People would tell me that they took the jab and that the description of this jab, ingredients  and contraindications weren't on the paper with the box. It was blank!! Who would take that?? To see all of the deaths even in my own small family happen, I couldn't believe this was not taken off the market. I've heard the CEO of fizer State that they knew this didn't prevent immunity!! I also  knew instinctively the game was genocide, early on!!   Uncle Jack, I  remember the day that I realized that our government has been lying to us all along! I don't  think I will ever believe the gov't and any 3 lettered agencies  ever again!   Thank you again for this very important podcast!",@joyrittimann9846,1,0
"Holly shit!!  “Delay, deny, defend"".  🤯🤯🤯🤯🤯🤯🤯🤯🤯🤯🤯🤯🤯🤯🤯🤯🤯🤯🤯🤯🤯🤯",@GrayHat0621,1,0
WE ARE SOOOOO FUCKED.  DANNY JONES I WILL 100% GIVE YOU LOVE FOR THIS ONE MAD RESPECT I USUALLY SHIT ON YOU A LITTLE BUT I DO WATCH EVERY EPISODE…. SO THANK YOU I THINK THIS IS VERY IMPORTANT,@GrayHat0621,0,0
I’m sharing this shit,@GrayHat0621,0,0
"What I also don't understand is Deborah Brix's biography, Silent Invasion, didn't land her in JAIL FOR TREASON. She tells on herself over and over, stating all the lies she told the American people! She knew how dangerous the jab was. Just a thought!!",@joyrittimann9846,0,0
I am 1h 8 minutes and dr.Kruze is making piggy squill on barbacue. We have a saying in my laungage that this lobbiyst would SELL HIS OWN MONTHER.,@nikolafrleta4609,1,0
"Why wasn't Calley called out for his psychological ploys used in this podcast? I respect moderators who moderate. Rules could be laid out in the beginning, then like a referee, he could shut down the ploy in play. Calley saying Jack's name, especially over and over, when Calley wanted to tamp him down? Psychological ploy to put Jack lower than Calley; childish. That should not have been allowed, and should have been called out and told to not do that again. That was difficult to watch and listen to. And, Calley wondering(?) why Jack gets so angry at him? That deflecting from the topic to put the audience's attention on Jack's 'supposed' faults, just shines the light on the obvious deflector's ruse (the ruse that Calley doesn't have much to stand on to convince himself nor the audience). I'm only 32 minutes in, and maybe I can stomach more of this.",@Onlyone9755,0,0
Jack is very off putting.,@eweinschenk2151,1,0
"There isn't a sense of optimism, there is fear that T will be a dictator who sells off the United States to the highest bidder, puts nut jobs in his cabinet, and lines his own pockets. Those thinking T is great is ignoring facts and reality.",@dcoleman4444,0,0
