text,author,likes,replyCount
Easy to not be as concerning as he should be since he isn’t experiencing complications as a result of the jab.,@marybethmichael186,0,0
I am unvaccinated. I had to have an emergency blood transfusion.  Everything i’ve read states that MRNA doesn’t stay in the blood. Is this true? Or should i be worried that i got “vax’d blood”,@hopefully2224,0,1
"Calley, you ""are excited to hear them talk""? Let them talk you conceited selfish like like like...ass. Quit talking about yourself it's so like like like tired. Take the cotton out of your ears and stick it in your egotistical garbage mouth.",@davidyeoman6013,0,0
Oh boy! Let me make popcorn this is gonna be good!,@globaldemise,0,0
This was difficult to watch but very interesting.!!!,@lindahuelsmann4239,0,0
"Calley is clearly deep state, calling a politician that got 90% of a vote a dictator is just stupid.",@JohnWilson-p6c,0,0
"I did some research about Dr. Jack, he's very knowledgeable. His anger during this interview does not show it.",@Nicole7601-k2h,0,0
"Means = 33, coincidence?",@lanina32,0,0
I left this with a completely different view of the Means.  I can't help but think he's pushing propaganda.  Thank you Danny Jones for this discussion.  We need more Dr. Jacks out there.,@lanina32,6,0
"Calley has my ""weasel meter"" pegged out.   He might be fine on a TV show but he can't hold up to a 3 hour podcast with knowledgeable foils in the other chairs.",@henrymull7386,0,0
"Great example of emotions trumping logic in this one. Even though they agree on most everything, just because Jack and Mary think Calley should prioritize according to their ideas and want to tear him down because he doesn't? I like Jack but the whole indignant anger is juvenile when someone comes willing to engage in discussion, whom at least Mary admits they both love his message. Danny even brings up that just because somethings bad doesn't mean we ban it. Have to disagree with most commenters, Mary and Jack came across as Jackasses.",@andrewleaver4850,0,0
"The moment I hear ""truth and reconciliation"" coming out of anyone's mouth who is even remotely connected to the government I know the person is full of it.",@korakcolour,0,0
Calley’s responses are evasive. Like pulling teeth to get him to answer.,@Palvan398,0,0
Caley sounds like the typical politician/lobbyist,@lisag4123,8,0
Answer is - his family didn’t get the jab so he’s not ignorant.,@JohnWilson-p6c,1,0
"Calley, stfu! You're clueless. You're completely out of touch with Americans...real Americans.",@davidyeoman6013,1,0
"It's so obvious when Calley is lying...constantly interrupting and attempting to shut Jack down, just to squirm and say absolutely nothing. Calley stfu and listen. You're disingenuous, not that interesting, and not important enough to listen to your trash propaganda story.",@davidyeoman6013,0,0
Deployed Worldwide Through My Deep Learning AI Research Library… Thank You  For Exposing The TRUTH 🙏 ❤,@robertfoertsch,2,0
STOP KILLING US !!!!! TAKE IT OFF NOW. Your full of shit Cally and you murder.,@natalieres3698,0,0
I love love love it!!! Jack you are awesome. You come ready with answers and really good questions. I've listened to a lot of your videos you are very knowledgeable thank you.,@camieapao8477,14,0
Americans side with Jack!,@tamisueminigh8109,0,0
"Calley sounds different than he ever has before on this podcast. He is very nervous, he’s getting confused about what he’s trying to say…I think Jack might be on to something. He will never focus on the Covid 19 vaccine, and when he made the rude comment that “maybe you two run in different Twitter circles” he showed a side of himself that’s incongruent with his cause.",@cindykenyon8754,1,1
Really MAHA? Trump never even mentioned it if he wasn’t sharing a stage with Rfk Jnr Calley never stops talking like a lobbyist . He never stops smooth talking . A man on a mission.,@TheFreelunch,2,0
Jack for president 2028!!!,@rachelevans401,0,0
"Never before, in the history of mankind, has one man spoken so many words, and said fuck all.",@greengenie2427,0,0
Wow. That calley is not to be trusted. He can’t answer a single question directly. Love Jack and Mary !,@trancemantrameditations,0,0
"They mentioned an episode with someone from the human genome project and the episode was oulled, which episode was that and is it avail on Spotify/patreon?",@Zomgwtfbbq1228,0,0
This guy 😡,@hopefully2224,0,0
"Now at the very end Calley questions Jack’s motives, i.e. integrity",@denel6,0,0
Anyone want to take a guess how many times Calley said “jack”Jack jack jack jack jack jack jack ♾️,@denel6,0,0
Anyone want to take a guess how many times Calley said “jack”Jack jack jack jack jack jack jack ♾️,@denel6,0,0
"Let's just say it. Jack may be incredibly informed, but he is also an A-hole with arrogance that can hardly be overstated. He reminds me of Trump in the first presidency when he spewed so much crap about so many things.  He sees conspiracies everywhere. He makes huge assumptions without any real evidence to support things.",@brittreid3981,1,1
"Every time Calley opens his  mouth , it's a red flag , it's so frustrating to listen to this phoney expert .",@mcgooss,6,0
Oh please CalleyI have had my naturopathic medical license since 2007. I would love to speak “from my heart” and let the audience “decide” who is the BEST spokesperson on food and health. How hubris…my sister dropped out of residency and she’s the BEST spokesperson. Let’s bring Dr. Berg into the discussion as well. It would be FUN..,@denel6,0,0
I can understand skepticism of the Mean's but Jack is unnecessarily aggressive throughout the conversation.  Seriously pulling there mother death certificate and attacking him.     Maybe Jack is a great doctor but he sure is an asshole.,@koko4kosh960,1,0
"Jack couldn't break through the impregnable phony barrier, but it was a good effort.",@aleph2d,0,0
"This  Means guy can’t answer a single fking question Jack is asking. The second Jack talks casey becomes the tone police. Casey is so clearly giving b.s. answers while Jack is literally just talking from the heart. Jack is clearly just pursuing truth & the fact that casey is sh*ting his pants the whole time tells us everything we need to know. I don’t trust this guy far as I can throw him. Dude just lost ALL credibility. Yes I watched every minute of the podcast. Great job letting them talk Danny, even though I think your annoying. You host a good podcast.",@intentionalinfluence3542,0,1
I cannot stand Calley...he is soooooo FAKE! Its so blatantly obvious he's fake. Thank you Jack and Mary!!,@tamisueminigh8109,0,1
Cali sounds more like the pretty boy in Canada 🇨🇦 as each hour goes by….,@denel6,0,0
all you ppl blindly following jack and not giving calley a chance are sheep yourselves. food is important. mrna should also be banned. jack is silly. their all helping americans imo.,@FeelFree2FeelFree,0,0
jack you need to calm down,@FeelFree2FeelFree,0,0
Blueprints from the club of rome,@bellaclyde,0,0
"If I was a juror and this was a court case and I was hearing all this information, Calley would be guilty of being deep state. Just like Trump and Kennedy!  Jack mentioned the  Hegelian Dialect and he was dead on. Our government is total deep state and will stay that way. Our only way for change at this point is the state level!  And that’s very unlikely.",@lisanash6487,0,0
"Maybe the fact that Calley is being the politician is that we need to get RFK, past the confirmation hearings and then we can ban the jab…we are so close…can Jack hold on?? We know all these babies are getting injured and we need the people in place to change this that have the power!",@lynnebd2214,0,0
"Maybe the fact that Calley is being the politician is that we need to get RFK, past the confirmation hearings and then we can ban the jab…we are so close…can Jack hold on?? We know all these babies are getting injured and we need the people in place to change this that have the power!",@lynnebd2214,0,0
Valley is such a libtard pussy liar,@SeniorSafeSolutions,0,0
Shouldn't Thalidomide be put back on the market and give pregnant mothers full transparency and let them make their own choice Calley?,@dawnkinateder9617,1,0
"He’s working too hard to defend himself and dancing around EVERY question. He’s definitely a plant, IMO.  thousands have been screaming his message for years and don’t get the press the Means have in the last 6 months. Fishy for sure!! Love this Uncle Jack!! You’re never wrong!! He underestimated what he was walking into ! I love it!!!! We need Dr. Jack to head up the MAGA movement. I’d rather have him than RFJ Jr",@Truthseeking2022,0,0
"Jack, Jack, Jack, Jack, Jack.",@robotjox77,0,0
Callie is condescending and that's disgusting behavior with this level of education!,@sharonolson5782,0,0
I sleep with my windows open because somehow it makes me feel better to experience sunshine ☀️ in the morning,@jennalindsey5290,0,0
The most direct conversation I’ve seen on the subject. I don’t mind the thrashing at all. This is what’s necessary to get through to everyone who’s been numbed the reality.,@PieretteMageo,0,0
Calley Means is an obvious slimeball...,@JewTubeSux,0,0
Calley is a pussy. He probably was abused and doesn’t even remember.  Now he acts just like the Enemy hahaha,@JesusGonzalez-op4wl,0,0
The way he keeps saying “Jack” is so condescending and on purpose. Called is being exposed for what he is.,@lisanash6487,0,0
Did they cut out the word Covid,@Mike-jr1vw,0,0
"When I read the comments, I couldn't believe it that not even one amongst the ones i read was able to discern what a truthful and good person Calley is.He has placed lots of energy into being sincere, but this, it seems, is not a language everyone (or anyone) understands.Even Jack, despite his unrelenting opposition, saw and understood his earnestness, but viewers didn't.",@VideoTranslations,0,1
Twho people that agree with each other and 1 cant see it,@micaht52,0,0
The level of political discourse in America is far behind basically every other developed western nation it's jaw dropping,@PurplePerinaise,0,0
"Pretty sure i counted Calley say ""Jack"" 2786 times.",@DaggsTheCurious,14,1
How do we see the referenced Kieran interview or however you spell his name,@StephenGardner1,0,0
"Dude does the fake smart guy stutter just like Elon, what a joke",@mega8man23,0,0
Here because of WarMode.,@mega8man23,0,0
This calley guy is a liar 😑,@DaggsTheCurious,0,0
Calley is a snake.,@mikeskummer,0,0
"Take a shot every time the dude says ""Jack"" in a condescending way.... No dont, youll be dead in under a half hour. Omg its so annoying",@DaggsTheCurious,0,0
"Take a shot for every ""jack, jack, jack""",@ZackOOria,1,0
"Dr Jack is 100% correct, Carlson and Rogan are deep stare fakes!!!  This is one of the very very few individuals I can get fully behind. The rest, you’ll need to earn my trust.  Dr Jack has my trust which puts him in about 1 in 1 billon.",@0towtfhowlifeworks299,0,0
"pretty obvious that 'calley' is tasked by his pharma overlords with distracting the public that 'junk food is bad' which has been known for 50 years, in order to cover up the massively destructive j a b.  calley and his 'never practiced' 'doctor' sister, are two pawns of the oligarchs.",@XanderDDS,1,0
Was he just returning video tapes?,@MrTravelinLight,0,0
Serious Patrick Bateman vibes..,@MrTravelinLight,1,0
I hope you have a solo podcast for Dr Mary coming very soon. This was incredible. I’d love to hear more about her story,@swishavsop2279,57,0
We don’t need a policy for our health…that’s this guys problem.,@0towtfhowlifeworks299,0,0
"I keep hearing cum shots when ""covid"" gets censored.",@polarpower6740,1,0
"No one is interested in your 'story' Calley, we just want the truth.",@Bionicwifey,0,0
SV40 keeps the virus lie alive. Terrain theory > Germ theory,@underthecanopy1093,0,0
I didn’t trust this pos lobbyist from the get go.  This is how these “people” have wired themselves by selling their souls and they skirt truth.  He reminds me of a lawyer…..politicians and lawyers are not human.  Awesome podcast!,@0towtfhowlifeworks299,0,0
"This guy sounds sleezy as hell. I thought ""Jack"" was spoken too much in Titanic .. this dude sounds like Rose",@justinskullhead,0,0
"Im listening to this, not watching and this cally guy talks like exactly like American psycho in the film. Very considered, very slow, very condescending, very creepy and the way he says Jack after almost each sentence is on point to the AP😅. And the way he keeps saying conspiracy, like it's a bad word that links all crazies together😂. He, They have no idea what we actually see when we look at them😂",@KimJordan-yg2yo,0,0
Calley did himself no favors here,@avakrisqj3129,0,0
Get rid of the mRNA shots now!! This guy doesn’t really want change big pharma and big food.,@StephenGardner1,23,0
"Danny Jones, I think you could improve your ability to moderate your podcasts.  Jack, in his usual fashion - had to monopolize the “conversation” and was completely belligerent.   Not sure why Calley actually remained and continued to put up with his conspiracy theories.   The questions pertaining to the death of his mother were completely inappropriate, disrespectful and shameful.",@amypollard-h5d,3,0
"The way Calley kept saying ""I'm just giving you where my heart is"" felt extremely unnerving to me, it did not seem genuine at all. I've seen people who are very good at acting innocent when accused, and Calley seems like one of those people. Of course I could be wrong.",@rttptt3710,2,0
"Jack Jack Jack Jack.. why are you being so mean? I’m just trying to bring about a new paradigm to science. To globalize healthcare, and to bring about a new world order.",@theshillpill6937,0,0
Calley needs to relearn how to speak English properly. It took me 12 or so pauses to watch and listen to this 3 hour podcast. I’ll never listen to him again.,@pattyjones6044,1,0
This title should be changed from Brain Surgeon vs. Pharma Lobbyist to Man vs. BITCH!,@joiedevivre7260,0,0
Jack is preposterous.,@frankslade33,3,0
Hell of a lot of smoke around Calley but he insists there is no fire…,@boob72,1,0
Jack cooked this clown; he gets so defensive and tries to talk his way out of questions he doesn’t want to answer.,@chadsnider6685,1,0
Jack reminds me of Cernovich. Very smart and provide tons of useful stuff. ANNOYING af know it all’s. He knows everything and any answer is not good enough. Ask the question and shut the fuck up and let people answer. We need to hear the answers.Rogan is part of the global elite? Tucker is part of the problem? What an idiot.,@shawn_derr,1,0
This piece of shit is a freaking fraud…. Jack and Mary got him cornered and all he could say was “but Jack”…. piece of sh*t!!!,@IveBeenChris,1,0
Calley is a p*ssy who is following orders because he is scare. Eat him up Jack.,@IveBeenChris,1,0
"Calley, ""and that's what we call politics baby,"" 0:00 - 3:07:54",@sacredearthco9117,0,0
I agree w the doctors❤,@stevennolte4830,0,0
"Listening to Calley acting ""genuine"" was infuriating...",@run4fun143,2,0
Calley is so pompus and creepy.,@roberta.6399,0,0
Bleeping out COVID is hysterical,@ironmaiden101000able,0,0
It's scary how deep he is involved and dose not see it....hopefully y'all help him😢,@stevennolte4830,0,0
1:53:25 yeah and Tennessee is gonna put vaccines in food 😂,@underthecanopy1093,0,0
"I think Jack (and to a lesser extent Mary) would have made their point more convincingly if they had let Calley Means complete his answers, and if they had been less personally offensive. Calley Means has not trodden the perfect path--who of us has? Who is born instantly perfect?This doesn't mean that Jack and Mary's concerns are not valid. The substance Jack and Mary want to remove from the market should be removed, in my view,  fundamentally because they were not tested to any standard whatever firstly, because of fraud in the original trial, and even more importantly, because of the switch to a different production method and the resultant undisclosed additional substances that were present in what was given to the public.",@robjones2852,0,0
He says the purpose of his book was as a gateway... he seems to me to be more of a gate keeper,@magilicuddy1827,2,0
To many powers in be aka...(Globalists) only care about $$$ and they installed the CIA to desensitize the human mind is disturbing.  Programming & propaganda rolled out over the populous using the big megaphone main stream Media.,@cherier3283,1,0
"I think Jack may legitimately be a narcissist. He constantly seeks praise and tries to destroy anyone who takes the spotlight away from him, even if for a moment.",@Avogadros_number,3,0
"This is what happens when the crazies win. They eat their own. If you don’t support and proclaim the dogma word for word, you’re secretly working for the enemy.",@Avogadros_number,0,0
"My Dad died in 1995 from Hep C all the doctors were baffled because he was not a drug user, not a drinker, no blood transfusion very healthy overall so how on earth did he catch Hep C? He did get vaccines throughout his lifetime, he even joined the navy. At 52 he had a liver transplant where they used a trial drug on him the name began with an R... I can't remember the name of the drug this was 30 years ago, he died 1 month after the transplant and his faith was sealed by Steve Johnson syndrome related to the many drugs after a transplant and the research drug they gave him after the surgery! 😢",@cherier3283,0,0
Death Certificates during the Plandemic were all documented as COVID 19!,@cherier3283,2,0
The fat doctor doesn't think food has anything to do with health lmao,@underthecanopy1093,0,0
Cali you worked for the enemy how the hell can we trust YOU! This is a disgrace Cali your future is sadly very grim for you have a role in the death march towards transhumanisum!!,@cherier3283,1,0
"Pfizer , Moderna and the others... Counsel of Foreign Relation, UN, WEF, The WHO, are all murderers!",@cherier3283,1,0
Globalist brainwash the young like Cali and now we are living in a nightmare because of that!!!,@cherier3283,1,0
The rich and powerful love cash! Ask them if they got the Jab and they did NOT! Where did the flu go in 2020!,@cherier3283,1,0
Jack is my new favourite man on the planet!Typical politician can't answer a single question. Said that fit bit had lower emf but then couldnt answer yesnor no on whether it had it 😂 what a farse. And why tf can we still not say covid without blocking it out? What a stupid world we live in. Boycott YouTube!,@PurplePerinaise,2,0
"WOW! I wondered the same thing why aren't the people in the ""Know"" so afraid of BIG PHARMA! I get it but if we all turned our selves to faith and GOD just maybe we all can tell the psychopaths to F themselves and shutdown Big Pharma murderers!!",@cherier3283,0,0
Watch Judy mikovits get destroyed by dr Kaufman over SV40 lol,@underthecanopy1093,0,0
Means reminds me of Kamala's dodging of answering a simple question.,@vote4pedro7,2,0
"""This is infuriating...""  You're right Jack.  Either 1) he hasn't looked at the obvious data.  2) Or he's stupid, (Which I don't think he is) 3) Or he's corrupt.  I'm extremely suspicious.  Who can you trust?????  Answer: Not Means' siblings",@vote4pedro7,8,1
"Jack talks about what we did to the kraut ms and what we did to the Japs but he doesn't realize that what he's talking about what the Yankees are going to be doing to the Yankees.  Having said that I agree that he a doctor should be sent to Guantanamo. Maybe we'll let Mary get a pass on  good behavior but definitely not him because he hasn't done Jack shit.  All he did was retire. And then 2 days a week volunteer .  He nevter achieved his goals and he went to a s*** school so now he's trying to s*** on everyone else. What they used to say in the 60s is that guy's got to get laid but he's NOT going to get laid because no b** , even the former jewish head of our federal health agency  would consent.  .",@LadyBug1967,0,0
"I don’t think Jack has hate in his heart, it’s called righteous  anger.",@tiffanyweisse6544,5,0
I have a hard time with people like Jack. You can be totally right but such an emotional aggressive asshole it totally takes away from the point. I see both sides and think there’s a lot of good to take away from this pod. I just rather enjoy a debate when both sides are respectful.,@rhandyfigueroa,0,0
39:02 Calle looking VERY nervous,@heartandmindovercome3214,0,0
"30 minutes in... Checkmate, and pharma boy knew it. He puts on a good show though. Unfortunately for him, that's all it is.",@heartandmindovercome3214,3,0
"Hi, yes, can someone please get uncle jack on trumps team? that would make my 2025 the BEST, thanks.",@jadestanley3859,2,0
"I hope the retired Dr Jack who they brought back like you do with an  old greyhound who's past  prime is aware that NOBODY in the comments have agreed that what he says about Rockefeller and this young man holds water. If he was their doctor and he helped them, they thanked him, and that's it. So I wish this Jack would get off his pedestal of old man wants to beat up young man because he NEVER got to the position that he thought he deserved in life. Jack is straight through BS. . I'm glad he's able to do a thing or two regarding healing people but frankly considering the level of the playing field it's not much.",@LadyBug1967,0,0
"9:12 I had NO IDEA people are STILL giving a newborn these ""s h o t s""  I fought hard against it then and thank god my son who is now 5 and my daughter who is 11 are both NOT pandemic jab receivers (trying to carefully word this) My husbands work forced it and he was one of two employees in the whole company who stood strong, managed to somehow keep his job until the supreme court reversed the mandate. So none of us got any. cut to now, almost everyone at his work who got it either had to be forced to take retirement early or had to try to get disability they were injured so bad. One guy got it ""to protect his elderly mother"" and he got so so bad we dont even know if he is alive now. was in a wheelchair after. 😬🙄",@jadestanley3859,2,1
"I love Jack, I respect Calley, and I dont know Mary....So LETS GOOO!!!! Im here for it!",@jadestanley3859,0,0
Calley: “why don’t you except my BS Jack?”,@tiffanyweisse6544,1,0
Wow please listen and share.  At 2 hours and 30 min on.  Calley is not who you think he is,@colleen1924,0,0
For Dr Mary to blame the lack of trust on non-medical person AKA Kelly on a person who they acknowledged has actually no medical degree and does not practice as a doctor a k e Casey is heating the true situation which is that we do not trust her or Jack because they are doctors. I do not trust any of my doctors but I have to go to them and every time they say something I research it and I find out they're wrong but it helps me because of my research to find out what I need and then I do it. That's what we have to do but I will say and I will agree with Jack and Mary that I do not trust them past my nose they are of the devil they are from the devil and they speak like the devil and if some people have been helped by them well thank God for that sometimes Christ and the angels can intervene even with the devil.,@LadyBug1967,0,0
I just tried to find Dr Jack Kruse on the web to see what school he is so not famous that he's not on the web &  obviously did not go to Harvard or Stanford or he wouldn't be dissing them. I did find a doctor Jack Kruse who solved his health problem by food and he wrote a whole book on it and created a diet to help Americans change their s*** way of eating so maybe he's jealous of that Jack Kruse  as well as this young man but I'm sick of old men being jealous and either sending out young man to die in war or beating them up in person on the web. I'm glad some of you say Dr Jack helped you but right now he is presenting himself as a Doctor Jekyll Dr Hyde.,@LadyBug1967,1,0
"WHAT IS MORE IMPORTANT. YOU BAN ONE VAX, OR YOU DESTROY THE WHOLE SYSTEM THAT CREATED IT... that's what Calley is aiming for.",@harmanjeetsingh3955,2,0
"This is ridiculous.Calley & Casey Means walked out of their respective careers because their eyes were opened to the devastating effects of pharma/food on their mother.  THEIR MOTHER. If they were weaker, less intelligent, less driven individuals (clearly inherited/taught - in part- by the same mother) they wouldn't have walked away from the env'ts that caused her chronic disease and death. The timing of their efforts was perfect for gaining awareness & coincided with (likely) the biggest mass-awakening in US history. Tucker then opened the floodgates when he interviewed Calley.People who have been insiders & then had awakenings are exactly the people you should WANT on your side.  They are whistleblowers.Who makes the best doctors? The ones who've woken up to the corruption & limitations of their own training in allopathic medicine, and retrain in functional med. This is EXACTLY what Casey Means is, and Calley is her analog from the PR/marketing world.Jack's incessant unhinged & ludicrously conspiratorial attack just makes him look hysterical.Mary's rage after her treatment at the hands of Houston Methodist and the TX medical board is completely understandable, but pointing fingers at Calley because he happened to have effectively the same awakening as her but has been more successful smacks of envy.",@carolann2930,1,0
