text,author,likes,replyCount
Watch this episode fully uncensored & ad-free on Patreon: https://patreon.com/dannyjonesSupport the show by checking out our sponsors:https://bit.ly/viiadannyjones - Try VIIA & use code DANNYhttps://whiterabbitenergy.com/?ref=DJP - Use code DJP for 20% off,@dannyjones,141,64
If they took vaccines off the market 1/2 the country would lose their shit.  These two lunatics want to sacrifice the good for the perfect.,@AC-sq1gt,0,0
Calley how many more babies and parents have to die while youre busy with niceties? Thats the issue,@educatedgypsee2351,0,0
Why would Jack turn down Rogan and Tucker? He could call them out just like he did this guy,@itsgoodtobeclean,0,0
"TRUST NOT... anyone who Slowly Measures their speech... Correct Jack... That person is FOS,  just as Jack said in 1st 4 minutes!  A young un-wise guy vs 35+ years of Wisdom.... on display!  jmo",@208lodge8,0,0
Transparency bro,@conorlynch1441,0,0
"OMG  Danny thank you for hosting this discussion.  I watched it twice, and the suit guy is so full of double speak, it was hard to sit through.   Scary to think he's headed back to Washington and speaking for us. No wonder US is in such a hot mess.",@MichaelMcLeod-k7q,0,0
"Wow, I read the Means book, Good Energy, and really thought they would help to make a difference, but I have to say Callie’s sketchy performance here makes me think again. Casey is afraid to actually take a stand, and sounds much more of a politician, than a freedom fighter. He talks over everyone, doesnt answer questions, but stops them from responding or asking him questions. Very disappointing!",@franherzog7073,0,0
"Great people who are so full of themselves they are behaving like children.  Imagine a table of 3teenagers arguing with raised voices at each other…oh, I am watching that as I write…NOT!  I turned this off for the nonsense of these individual.  Too much ego in one place.  Completely a waste of time and talent.  Good try Danny",@russellstearns9999,0,0
"Omg watching this has made me nauseous.  Seriously. Why is this calley spouting word salads and slick verbiage stammering and side-stepping questions. Jack is so frustrated with the arrogance and repetition and lack of true conversation. Its just painful. Im totally confused about the subject!!! Sounds like a meeting in the senate. Dump the shot for crying out loud.bits doing harm,!!!!!   😢.",@barbaramcdermott2757,0,0
wow kinda losing lots of respect for Cali Meanes....... 100%,@the69dragon,0,0
Total Jack count anyone?,@grannyali6567,0,0
big pHARMa EUGENICS that's the fuckin' agendasnake in the suit speaks with forked tongue & Jackhas that fucker's number!,@samwhitty3036,0,0
Wow is Calley tongue tied.,@katharinewooten4436,0,0
"OMFG!!!  I couldn't make it past 20 minutes of this shit show...  I unfollowed Mary on X a couple of months ago because she just seems like a very angry B!tch and this ""conversation"" did absolutely nothing to change my mind.  And, I've never seen or heard of Jack before, but he's almost worse!  I really wanted to hear all sides of this topic and have been opposed to vaccines my whole and long life (my kids and grandkids are unjabbed), but I would have to recommend Anger Management classes for these idiots!!!",@sandroitsme2560,3,1
"This guy Jack might be a genuine good guy that's just righteously pissed off and rightly so if what he is saying is true, but he needs to stfu and let Calley speak. His attitude isn't doing his argument any favors imo, he's being very aggressive and condescending. Not to mention that he thinks every other person or group that he mentions is some kind of a gotcha moment against  Calley. Meanwhile Calley isn't trying to hide or deflect from anything.",@CunningAndGuile,0,0
"HOW many times did Calley say “hold on, hold on”, or “Jack, Jack”. Just answer the questions Calley. Stop your BS.",@Netzarim007,0,0
02:41:56 is the main takeaway of the podcast. Calley said it well and it answers Mary’s question at the beginning regarding why he has a larger megaphone than them.,@JosephBojang,0,0
Another WOW !!!Between the UTUBE censorship and the ridiculous level of hostility of this “Dr.” Cali Means has the patience of Job !!! These two have no idea how policy is made ! You can’t be so controversial that no one will listen to what your saying! The point is to get to the place where you ACTUALLY have the power to change things ! The deep state is in place till Monday Jan 20 @ 12:00 !,@mebmom3,0,0
"I am out,can not have a conversation without people talking over each other.",@Jzsons,0,0
It was a great discussion,@dickieromans6235,1,0
Calley comes off shady AF.,@isaacmontoya9144,1,0
Seed oils & the 2000+ other banned chemicals that we come into contact with in our daily life. Leave the US.,@nickrajotte6802,3,0
"Jack Kruse is goat, and a bitcoiner. lets gooo.",@desade9baron,1,0
The cracking fake voice of the very well trained psychopath... Calle's job is  to spread confusion...CIA chump.,@ronwishbone,2,0
The book deals have been for a long time ago way of payment for the globalist cabal agents or those working for the agenda. That's obviously why the lobbyist sold 1 mill copies right off rip. It's just another way of payment or bribery duh.,@bennettchandlerii3614,1,0
"Calle definitely is fake..100% voice and hands fake..Sounds more like a fake politician...Jack is a monster, love the guy...",@ronwishbone,2,0
"I'm with the doctor, Calley dances too much",@cathymcmahan7530,2,0
So Calley…the people that pay for this political government are not interested in politics…the poisoning needs to end now or we will in our minds hold everyone who is concerned more with politics as part of the problem.,@brendasei7112,2,0
We are absolutely with Jack On swift and immediately decisions and accountability. THEPEOPLE are waaayyy past transparency!!!!!!! Let us be very clear!!,@brendasei7112,3,0
It sounds like Cali wants a truce that's what he means by a science reset like just look past all the crimes against humanity and forget about it all. NO WE WONT FORGET! I am starting to wonder about how much this administration will actually get done that truly benefits we the people and our freedoms.,@bennettchandlerii3614,2,0
Cali is so full of sh!t it's obvious. He says utter transparency and truth 😆 but that would mean immediately banning and arresting a whole lot of people. He keeps reiterating oh it's not a debate because he can't debate any of the real data. The lady and Jack are fantastic we need more people like them that don't pull punches and say what they mean.,@bennettchandlerii3614,1,0
I’ve lost respect for Jack,@donnalindsay3744,0,0
"She needs to simmer down. If they pulled these products from the market, the people who believe in them would feel like they’re being controlled. It would make YOU feel better, but doesn’t give you the right to make decisions for others.  One of the reasons why our country is so divided right now is because choices were taken from us during Covid.  You need to remember that and allow people to reach their own conclusions; not forced into it.  Do some inner work and find out what makes you feel the need to  control others",@donnalindsay3744,0,1
My Bullshit meter is off the charts with this Calley guy!,@Del-du5jx,2,0
"Five topics to fix society via discussion:-Anti-natalism vs Natalism -The 3 basic needs/prenatal needsThree things necessary for human evolution that are provided while in the womb which are; food, shelter and medical care.-Platinum rule Do whatever makes one happier unless it interferes with another persons ability to do the same.-MBTI (research yours and connect with others)-Art (pick one and get better at it!)",@deshaebeasley,1,0
"This cabal tool knows NOTHING about spiritual awakening - the EXACT words cabal has started using in the last month or two to muddy christian waters, using every tool to hook the sheep - Pulls out the anger & hate cards, not base - sounds like all manipulators / fraudsters",@redtoplanding5160,1,0
"Also, we do NOT need to vote for personal sovereignty!!!We are born with GOD given rights, period!!",@kebbasda,2,0
If parents are that stupid to NOT know the difference between junk processed food their kids sick and dumbed down they have NO business having kids and parents who even buy that type of book he wrote SHOULD have been told to NOT give their kids the vaccines! POOR parents are NOT going to buy books on food to feed their kids. Get real.,@ozarkcyn1,2,0
"Lost a lot of respect for Calley in the first 10 minutes. The vax is poison, plain and simple. It’s a crime to give it to anyone from age 0 to infinity",@matthewclark3053,3,0
This fucking guy is impossible to even listen to,@MagyJne,1,0
"Pulling everything and adding back is what is done with allergies, why not in Public Health Medicine",@albertsimpkins6664,1,0
I think the whole point of the Means' is to protect the guilty from the justice they deserve by policies that just resort to moving on. That's the mission right now.,@DanaJumper,2,0
Calley just answer the damn questions 🙄,@cwilliam2994,1,0
"it has just startedhe is telling his storythen he saysI think bobby kennedy being on a national stage is miraclewell, that's disingenuousHE IS A KENNEDYnot only that his name mirrors the horrors and tragedy that befell bobby kennedymaybe it is miraculous that he is on the national stagebut disingenuousto imply it is a miracle that bobby kennedy is on a national stage.",@superdupper01,0,0
Mr na is in your food,@goathead3329,1,0
"Mr means, i feel your sincerity and yes Sri and intelligence's are all directed by a specific agenda, when you put all the skull and bones and all the structure itself, you know you did not fit in the mold but you made compromises in yourself (ignoring call things conspiracies) to be able to have a career in such programming, you can call it brainwashing, just as long you go along they will not let you know more if you don't ask the right questions and if you ask the questions it is because you already know the answer. walking a narrows path that was set/ programmed before you. view it this way, they best keep you busy than truly aligning with your heart, i believe now at this moment you start seeing, it's one big vibe,if you think the way they want. you are chosen.",@mysticalsoulqc,1,0
"Wow Mary calling Calley ""rude"" after berating him multiple times even when discussing his dead mother.  Wow. Wow. WOW!!!",@scorkren1118,0,1
Grateful that Jack is waking people up! And I'm appaulled that not enough people are angry!! We see right through the bs. Thank you Jack for helping us!!!❤💥😇💜🙏,@noraedithacevedo1448,2,0
I've tried to make it through this podcast 3 times!!! Danny Jones -- if you are going to cover these highly controversial topics you need to learn how to moderate your damn guests! Jack may have an important message but he SUCKS BALLS as a messenger. Ugh!!!!!!!!!!!!,@scorkren1118,1,0
Jack for president,@bigsamindaplace,0,0
"Im halfwsy through and i cant take anymore. I dont know whos the worst jack, mary, ir the other guyjack is bad but mary seems to really irk me. But i cant stand when grown ass adults cant let other grown ass adults speak their peace  then when theyre done, give your reply. So bye bye",@hypsyjoo369,0,0
No way did this guy take ANY jabs.,@corny5128,0,0
"He’s very nervous, and desperate for Jack to stop, but Jack smells fear.. and knows there’s a reason for it … ‘jack, jack, jack, ‘ 😂",@coopercooper8406,1,0
And still there is no mention of the REAL elephant(s) in the room.,@corny5128,1,0
"1:05, heat turns up and Calley is ready to RUN!!!",@jsa310,0,0
The C and V words are being muted. What a shame. We are living in a strange time….,@jsa310,0,0
Means is going down if he keeps acting this way!,@jsa310,0,0
Calley Means is a jackass. Thanks for shedding light on him!,@jsa310,0,0
"They're successfully treating pancreatic cancer recently in the UK at least. It's at a beta type stage treatment atm but the process is sound and tailored to the individual, also Leukemia has been succesfully treated and the potentials of the methods to be used for other cancers (mainly from the pancreatic type treatment used) SHOULD soon be harnessed, along with other new methods perhaps to maximise the success rate and fine tune the processesses for other cancers. Or at least I hope it goes that way. o7 Danny, loving the shows.",@5P4C3d3V1L,0,0
Wow! Let’s see now if Casey and Cally are under MK Ultra or if they were just ignorant. Huge thanks to ALL of you on the panel! ❤,@LightOnLaura,0,0
Does Jack truly understand that a Constitutional Amendment would take at least a decade to pass even with the will of the people behind it - provided it passes through Congress’ very high requirements for passage.,@TheFatGandalf,0,0
If people can’t see that the twins are complete paid off skunks then I don’t know what to tell you.,@PermaPasturesFarm21,1,0
End mRNA technology in all products!!!,@radensmom,0,0
His name is kali means hahahahahaha😂😂😂😂,@goathead3329,0,0
"hes not denying the damage from the shots. People can be healed from the shots with proper nutrition & proper supplements, sunshine etc WITHOUT acknowledging that their health issues came from the shots",@Toots22,0,0
"I can understand that jack and mary feel very strongly about their positions, and rightfully so, but their attitude (mostly jacks) is frankly overly aggressive and off putting. A huge number of people still buy into the covid narrative and response measures. These are the people who need to be convinced, and it won't happen through someone like Jack. Imo, if he actually cares about his message, he should be more tactful. Is Calley some WEF globalist agenda shill? I don't know, but neither does Jack. He's making accusations with circumstantial evidence. Everyone should be skeptical, but being skeptical also means being open-minded. Jack does not come across this way and at many times seems very narrow-minded. Regardless of whether Jack is entirely right, he needs to be able to reach people in a more effective way. One of his big points of suspicion is, ""Well why haven't I gotten as much attention as Calley?"" From my perspective it's because he comes across in a very unpleasant and condescending way. He is shooting himself in the foot by carrying himself in this fashion and won't get very far with spreading his message.",@darienkinne1347,1,0
"Why wait so long to publish.  It says released two days ago, then on December 26th, but it sounds like based on the time frames they refer to, it was recorded in early December Why?",@scottymills9739,0,0
"Calley is full of shit won’t answer question straight exactly what jacks day he falls back to training to any question, also the bloke looks like a weasel smirking an trying be wise ass at everything coming his was 💀🤣",@billysshiftytaint3757,0,0
Slither slither,@jowoods8009,0,0
I can't even watch and I'm only quarter of the way in what a mess we are in,@peacelilly75,0,0
"Anyone else get the feeling that this is just like the ""Matrix man"" vs Neo.  The corporate suit is the tell tale sign. It screams money is my God over humanity.",@kehreyannedean6315,2,0
I don't even trust him,@peacelilly75,0,0
Urgh brother what that,@peacelilly75,0,0
The lobbyists LOST... big time.,@kehreyannedean6315,1,0
OBVIOUSLY.... The lobbyists job is to PROTECT the profits of SHAREHOLDERS.  THAT is the core issue.  Everyone knows all this is wrong.... but no one wants to lose their MONEY.,@kehreyannedean6315,2,1
Well one's influence is solely MONEY... especially when it comes to big pharma.  Lobbyists become lobbyists because MONEY and lies are their game. So I would trust the brain surgeon before I EVER trust anything a lobbyists says. Lobbyists (professionals in the field of BRIBERY) have split tongues.... and they are loyal to the money that pays them... period.  Sounds like he is trying to deflect and redirect blame toward medications (not jabs) and the food system.  You can tell he is kikely being paid to be projab.... but won't let his own kids get those shots.   When someone won't say yes or no.... there is a reason.  Likely a backroom deal behind closed doors reason.,@kehreyannedean6315,1,0
In my opinion..... Tucker Carlson is CIA.  Always has been.... always will be.  He is controlled opposition. I would never trust him regardless of what he is spinning.,@kehreyannedean6315,2,0
Danny is a Evil Globalist & payd well to do his  Evil job.His not human,@mariaornelas4939,1,0
He didnt write no book 😂 he looks like he doesnt know a thing thats in the book,@iamup5et,1,0
I’m all for what him and his sister are trying to do with the food … I’ve been sick for over 5 years post covid …. But Jack is right he does sound just like a typical politician I think he truly wants to be in the political game and that’s all he cares about…. People need to go to jail over this shit or it will never stop … so I think Jack wins this fight. Any legit doctors read this I would really love some help to get my Heath back … Jack please reach out if you read this. My gut is fucked and I’ve been listening to what you have out there and think you could help me get my Heath back.,@steveklingelhut9266,0,0
Kruse is a bullshit artist,@blahblahblah6378,0,0
#DrJohnCampbell,@jowoods8009,0,0
"Man... I'm only 1/3 of the way through this and it's hard to listen to. I commend Calley for coming on to the podcast, so far it's tough to hear him seemingly skirting important issues. I'm not really familiar yet with him or his sister, though I know they're suddenly everywhere and my wife read their book. Why he won't even give a clear answer on why he doesn't feel the ""you know whats"" should be immediately banned is very troubling. Dr Jack Kruse is extremely impressive. I wouldn't want to ever get on his bad side and have to debate him.",@ChrisCassidyeXpRealty,1,1
"Cally Means is highlighting the problems of the world. He has  a lot of words and soft tones and nothing to offer. Everything that he is asked to validate he knows nothing about but supposedly he's a professional...and he seems more insulted and interested in the way he is being addressed, than the well being of any and all humans.",@Amberstiner,0,0
Calley is a useful idiot.,@scottiemackrell3472,0,0
"I tried to listen and got about an hour in, but I can’t stand the constant arguing. Sorry, but if you’re going to be combative you can’t share your message. Find common ground guys and move forward. I would have enjoyed more Dr. Mary too. Jack can grow up & communicate like a freaking adult. Anyone can yell & point 😂 it’s ok to be pissed, but your message got lost for the newbies in the audience.",@ashleypotrykus6248,0,0
HE SAYS THE AMERICAM PEOPLE....GLOBALIST,@maxlife9721,0,0
OH MY HELL THIS LOBYIST WILL NOT STOP LYING...HES THERE FOR MISINFORMATION....100% DISHONEST,@maxlife9721,2,0
He’s a smooth liar. Master of Deception.   I give him A+ on deflecting. I do not trust him. At all.,@rachelekofford9132,1,0
I found it hard to listen to due to that fuck wit Jack not being able to hold a rational debate just jumping from conspiracy to conspiracy bringing up his mothers death and death certificate. And interrupting constantly,@craigscanlan599,0,1
HOW ABOUT REMDEZIVIR KILLING PEOPLE IN HOSPITALS...THIS WAS MURDER BY THE HOSPITALS,@maxlife9721,0,0
Holy shit!!!! Talking about his mom and he's just sitting there taking it.,@scottymills9739,0,0
HES ACTING LIKE THINGS ARE NOT ALREADY OUT THERE AND THE DATA IS NOT THERE....BY SAYING WE SHOULD....ITS ALREADY THERE....PHARMA GUY IS DISHONEST SCUMBAG,@maxlife9721,2,0
Policy processing.  In order to get the vac out like it was.  There had to be nothing else that was able to do same job.  Well now we all no ivermectin was just as good if not better.  But no money to be made on it because patents was open ..no Monopoly on it.  Id like to know who got paid what during that big rob of tax payers . Out grand kids kids will be paying for that. This country is a joke .Greed has destroyed it .  Greedy bastards goin destroy this planet.,@marshallwilliams2990,0,0
THIS PHARMA MAN IS PURE DISHONEST FULL OF CRAP,@maxlife9721,1,0
The dude is too much. He tries talking over her every words and then wile he talkin. Shuu her.  What a narcissist.  Another prick with a title thinks better everyone else.  But I bet give him 6 months were no daddy money and no help and toss out. Like rest of country. See were is 6 months. He be dead from od or in jail. It's almost against law to be poor in this country.  Jail is full poor ppl.  But if u got oj money or MJ money.,@marshallwilliams2990,0,0
IM DONE.,@Patty62172,0,0
Jack your mean,@Patty62172,0,0
Jack said stand ford is Dark who else went to stand,@Patty62172,0,0
Wait a minute Jack. CALLEY IS HONEST ABOUT WHAT HE DID. SO HE DIDNT HIDE ANYTHING,@Patty62172,0,0
I can't do this mary and jsck,@Patty62172,0,0
Jack stop being ANGRY,@Patty62172,0,0
"This Calley looks really stupid 😅 all he says is ermmm 🙈 How on gods earth has he climbed up that ladder, he’s an absolute amateur 😂",@burkezmcr4038,0,0
43:09 sounds like an xbox live lobby 😂,@BrianSimpson765,0,0
Jack Kruse is the man!,@62LeftyBlues,0,0
Calley Means must have trained with Harris because all he gives is word salads.   He is well trained in lying and deception.  You can tell because anytime the Dr's call him out he gets nervous.  Dr Mary didn't get to talk much so she needs her own podcast.,@clamhomesteadadventures2932,1,0
"holy shit bro this guy is so annoying all i heard for 3 hours is “jack jack jack jack jack, pls, jack jack jack” holy shut UP bro",@goldenfoenam,0,0
Thr guy in the hat needs to learn some manners .,@kenadams5504,0,0
"so he looks down when he fishes out a coherent diversion. eye contact while pathologically polluting the emi field is next to impossible, also the soul( although barred) still has some pull but not much. when the left side digs in to pry out logical nouns and adjectives this is the window for the right side, this is when the head tilts slightly forward and the eyes are almost fixed on the table. on the flip note, you'll never get a straight answer these types of people get a hard on when you play this game them.",@Findmylimit,0,0
"Calley ""i believe people should have the free will to take a product they have no fucking information about but not my kids"" Signs of a snake.",@TheBitcoinWatcher,0,0
"Wow Jack.  I don’t like you.I’ll never take the jab and I might live out of this country.Just so you know.But antagonizing and being so freaking proud of picking on a guy half your ageis not doing anything for your cause. You’re into proving yourself right no matter what.Even if you’re right which I know you are, you’re OFF.Jack take this the right way!",@patriciamoore3318,1,1
I’ll talk to you Jack!,@patriciamoore3318,0,0
Jack pick on somebody your own size.I get you care.Yet it sounds as you’re out to be right.And now you’ve lost.Is it all ego.That’s fine that you’re out of US.  Look I agree.Jack if you care you’ll stop being right.Ain’t moving the needle.,@patriciamoore3318,0,0
Jack of course you’re fighting for the truth.Don’t be an optimist Jack.So it’s about being right!?Jack you are starting to sound crazy.Jack if you care about Covid and the getting medicine out of the system.You’re about being right!  I’m out Jack.,@patriciamoore3318,0,0
"See Jack says Calley is dead wrong.  Jack isn’t getting it either. And I know you’re great!!(Guantanamo as the first thing, think about it.)Calley would have never gotten the book through.  And keepattacking someone who is NOT in front of you looks weak to me.She’s not present.",@patriciamoore3318,0,0
"Of course Covid is the most important story!And you need to open up people’s listening.  Getting these people that agreewith you and I agree with you, does not open up listening.",@patriciamoore3318,0,0
Exactly people!  StrategyOpen up the listening!,@patriciamoore3318,0,0
I want Jack to read all comments and replies.  Other than just getting everyone agreeing with him.,@patriciamoore3318,0,0
"Calley is younger.  So yes he’s susceptible to mk ultra, etc.Jack you are pulling power trips.  Yes I agree with all you’re saying. Yet you sayyou and Mary want to do what Calley’s been able to do.  This ain’t the best way.",@patriciamoore3318,0,0
I can't........🤷‍♂️I CAN'T. 😠No information. It's like a conversational circle jerk & no one cumzz. 🤦‍♂️ CLLLLLLLICK *off*. Next video. New Channel. https://youtu.be/3I0K-ymOTS4?si=bhvGPifwSFMylfU6,@RedArnold-i9y,0,0
I like that a pharma lobbyist has considered the best way to make money in his job is tyrannical and hes very mindful of this,@andrewflowerandrehew9765,0,0
Surely the cov shot mandate being rebuked will kickstart the momentum to clean up the unhealth industry,@andrewflowerandrehew9765,0,0
Sounds like government and phrama want a real war... Sorry  to anyone who gets in the way!,@finishhim84,0,0
Sorry I think I got the men mix up. It's the dark hair guy I don't trust he is guilty of working for the deep state. I don't trust lobbyists.,@dianefant9486,0,0
"Callie reminds me of Jamie on Yellowstone.😅 Yes, I'm stereotyping. The hidden hand of the magician always has everyone looking at one hand while they the sleight of the other hand is at work. 🎩 🪄",@kristinak1972,1,0
Never trust a Lobbyists! Their dirt bags working both side Congress and Pharma.,@dianefant9486,0,0
"He is very, very uncomfortable!   He a deep state doctor for sure. He is selling the deep state agenda its.",@dianefant9486,0,0
His body telling you he is full of BS!,@dianefant9486,0,0
