text,author,likes,replyCount
"If you guys enjoyed this video, please consider supporting me on Patreon: <a href=""https://patreon.com/MegaLag"">https://patreon.com/MegaLag</a><br><br>If you have any inside information about PayPal Honey or believe you can contribute to this story, please feel free to contact me confidentially at megalagtips@<a href=""http://proton.me/"">proton.me</a>",@MegaLag,23905,539
Cannot trust those guys on the thumbnail?,@logic8673,0,0
I like that the influencers got f*<b>**ed to when they advertise that sh***</b> 😂,@PeterJung-cx1ib,0,0
This is straight up evil. I knew Paypal is  no good. The moment I registered there my data was sold. I receoved phishing mails and calls DAILY. This company is EVIL,@filsc,0,0
Its not their fault tho they didnt know,@TeumuTemara,0,0
"<a href=""https://www.youtube.com/watch?v=vc4yL3YTwWk&amp;t=1174"">19:34</a> it&#39;s a protection racket 😮",@Epinardscaramel,0,0
Still waiting for part 2...,@K2MusicKSquare,4,0
So? Are you gonna drop a second part or just disappear?,@narwhal9852,2,0
Markiplier was right and is still right,@vector6052,0,0
Question… does capital one do this?,@aaravpatel11,0,0
This now begs the question of where did Honey get these Coupons then?,@dondigao1057,0,0
"<a href=""https://www.youtube.com/watch?v=vc4yL3YTwWk&amp;t=9"">0:09</a> I know what  he’s gonna up load on Feb 1 2025.",@Idontcarelolll,1,0
"Awesome investing! I never installed Honey, but I use PayPal all the time for purchases. I&#39;m so mad at them now for this, I&#39;m going to stop using them unless there is no other way. Thank you for opening my eyes!",@teriwelshanscp3528,1,0
how else you expect them to make money?,@gart6306,0,0
How many people are here because of what Markiplier said,@scourgemalje5926,0,0
I FVCKING LOVE BLUE FLAGS,@HiveCraft2x,0,0
Excellent investigation!,@brandonwadlington8552,0,0
The video is soooo satisfying that I can&#39;t help coming back to watch it again and again since it came out.,@Sop7anaAllah,0,0
Wonder where’s the comments of the YouTubers that sponsored this,@meltingstream3385,1,0
"I think you are off base about ltt man, why single them out and none of the other creators?  LTT response to your video really shows you missed the mark. I think you should issue a retraction and an apology.",@RobertKirkpatrick84,0,0
😂😂,@julienpaskar5738,0,0
Bro drop the second part.,@TheDUDERX,3,0
WTF!! THIS IS CRAZYYY!! SCAMERZZZ <br>Thank u for this infooo Genius<br>when is part2???,@joelleedde,1,0
😮😳,@KitKatSukiKat,0,0
"Thank you for sharing this :) but this might be a very silly question, for the second scam, if the website doesn’t want to provide like 15% of promo code, why don’t they just not set this kind of discount but to partner with honey?",@nickno2980,0,0
where is part 2,@joemama38,2,0
Oh i just discovered that LTT and MrWhosetheboss got &#39;infected&#39; with the scam too... Now im sad.,@VoidTheGamer_Roblox,0,0
"I mean I don’t really care, as a consumer if give me $.89 back while going through the YouTuber I get nothing back",@thejinx9891,0,0
"3pt investigation, goes missing for a month after pt1 is posted.... one has to wonder, did big honey silence Mr. Lag",@cressthunderhawk1492,3,0
"The fact that @linus cant identify n reframe this to wake the customers up, its just too bad",@MrPingping168,1,0
"The Villager News at coordinates (4:2) at <a href=""https://www.youtube.com/watch?v=vc4yL3YTwWk&amp;t=92"">1:32</a>",@Yellowbob1,0,0
Shoutout to markiplier for calling this out 5 years ago when everybody was calling him crazy for it.,@trevorrasbury5903,1,0
Raise your hand if you predicted Honey was a scam ✋,@louis7707,0,0
Honey comes through for me on occasion. Of course i heard about it back when we had commercials on tv not from some jag off gen zers tiktok,@Analwreckage,0,0
Marques  stole your video AND thumbnail @MegaLag,@Cookiethebestwithapaw,2,0
Every time I see a pop up I automatically think computer virus so I never click on it or I don&#39;t buy anything from that page at all.,@dirkdiggler2430,0,0
Tried once found 0 coupons and deleted that mf real quick 😂😂,@longvo11,2,0
"Since you made this video, has anyone else picked up on it and got onboard with what you&#39;re trying to achieve here?<br><br>I am sad to say I have been using Honey since before influencers started to promote products and it has been utterly useless (maybe once I saved $5). I will now uninstall it. Thank you for your video. 🙏",@nakitacally4612,1,0
"Damn, I didn&#39;t know 1 whole month was considered &quot;soon&quot;",@siri3200,4,0
"&quot;This honey influencer scam is so sticky, even Winnie the Pooh is like, &#39;I&#39;m out!&#39; 🍯🐻",@OfficialBeBigTV,0,0
I am advertise that advertisers like google didn&#39;t raise this sooner if ads on your platform appear to have lower conversion rates because an extension is taking credit for advertise less businesses are going to advertise with you and you can&#39;t charge as much,@greenerell484,0,0
"<a href=""https://www.youtube.com/watch?v=vc4yL3YTwWk&amp;t=297"">4:57</a> I knew it would do something like that",@greenerell484,0,0
well I never used it wanted too many browser permissions,@greenerell484,0,0
"A wise man once said &quot;If it&#39;s too good to be true, it probably is&quot;.",@jonibravo99,0,0
Elon Musk is watching the chaos,@VuNam_MCVN,0,0
Thanks for your investigation. Why don&#39;t you consider suing Honey and maybe team up with a few other creators in the process? Let&#39;s destroy this business together.,@DipanjanDe,2,0
ok now i know Honey is a scam now...i&#39;m not so sure about paypal now -_-,@DIIELAST69,0,0
Who falls for this stuff? &quot;Apply discounts&quot;<br>Glad I never installed any of that crap to save a few bucks.,@rssurge,0,0
Does he sound like hugh Jeffrey,@Thecrazygamerkid0616,0,0
I think 100% of the blame lands with honey. Just sayin...,@cicio7777,0,0
"In the 22nd century, Honey will be taught in history classes as a cautionary tale about greed.",@soup9242,0,0
"<a href=""https://www.youtube.com/watch?v=vc4yL3YTwWk&amp;t=459"">7:39</a> who else was expecting, &quot;which is why this video is sponsored by honey!&quot;",@RyanLorber-j1i,0,0
What the hell,@dzeuse65,0,0
glad I ignored honey,@ZippyCoons,1,0
"@megalag hey man, your mic has a strange low frequency hum in sections without background music. Maybe look into it. Nice vids in any case, keep it up",@DummyCrosS,1,0
Anyone know when part 2 is coming out?,@ronb2008,1,0
OMG influencers were lying to me????,@bowlochile,0,0
"I barely used honey. But the times I did I was glad. As I didn’t really look around for discount codes anyway, so to me as a consumer, even if not offered the best coupon, I still saved more than what I would have to search for a code.<br><br>However, I don’t often associate myself with affiliate links anyway, as unfortunately I find many affiliate links are YouTubers promoting something they probably never use or ever cared to really even try.<br><br>I think honey is a massive scam after finding this out and it’s very unethical, but I also find many, many YouTubers promoting garbage in return for their commission. While there may be great YouTubers out there who generally look for the best partnerships with their affiliates, I find more than not, they are promoting garbage. <br><br>Although honey may be stealing commissions, and they should have action taken against them, I don’t care so much for the YouTubers who lost out because they promoted garbage. <br><br>I saved money I wouldn’t have, do I feel conned? Maybe a little. But I never fully believed it tried finding me the best deal regardless. <br><br>I feel sorry for the legit YouTubers. But when it all comes down to it, YouTubers are conning us and trying to pick the best affiliates in terms of how much money they can make, rather than giving legit recommendations with smaller commissions, something needs to be done based off both scenarios.",@zZULTIMATEPROZz,0,0
"Honey shows you the price history graph, so its not a scam at all. If I see the price is at a high point, id definitely not buy it, if it were at a low point, id consider a purchase. Plus the promo codes in case you forget, it is very worth it.",@MrBeeastFan,0,2
"Im guessing the businesses that don’t partner with Honey get rocked by discount codes that the customer shouldn’t have, thus forcing a partnership or extreme discounts at their company. But that’s just a theory, a scam theory.",@andrewmiller8402,0,0
why are the big influencers not suing paypal for all the potential money they have stole from them since 2017?!?!?! Or is it because its owned by a giant corporation in Paypal?,@Soulebi03,0,0
yo its been 4 weeks what are you waiting for nobody cares about this anymore release the rest asap,@keyboardwarrior34,1,1
"so its still legal? its still available and google chrome has a fake review rating on it, seeing how all the massive amount of new reviews are 1 stars",@bluecheeseorfumyourmother,0,0
"I want to point out the BBB is just a business. Companies can pay them to have bad reviews removed. Its not an official government agency, its just a business.",@richardd.7479,0,0
…,@SophiaCohen-lh6sk,0,0
I am glad these influencers got scammed too,@richardd.7479,0,1
This video is so over dramatic. This is about a browser extension getting commissions they didn’t earn lol,@Lucy-fn9rj,0,3
🫡Damn they got em. It’s been 4 weeks and part 2 is nowhere in sight. 😭,@AnonymouslyForgotten,4,0
Honeys founders are genius,@aftabmaldar-jf9gg,0,0
Smart af,@chandansahoo2925,0,0
MARKPLIER WAS RIGHT! HE WAS GODDAMN RIGHT THIS WHOLE TIME! I KNEW IT!,@Purple_Haired_Dumbarse,0,0
"LMG has to be the dumbest team ever, they found out honey was stealing their money by changing the affiliate link so when they switched to karma they decided to not see if it was doing the same thing???????😕😕😕😕",@Sflixy,2,0
Thank you so much!,@KryszK,0,0
Wow! Perfect example of corporate greed and sleaze. No doubt the slime that thought this was a great way of raising revenue paid themselves big bonuses. I hope they roast when the class actions hit!,@dcee2899,0,0
Next up : nordvpn,@HughJanus-e1j,1,0
"Bruh. I remember installing it, checking a few shops where I actually wanted to buy stuff from, seeing it did nothing and uninstalling it. Lmao.<br>Always think for yourself :&#39;)",@SariniyaKiyu,1,0
Isn’t there meant to be part 2/3????,@Tuffest_Leader,1,0
"Hey greg, join honey.",@SUCHEASYTIPSyet,0,0
when can we expect part 2?,@mauritsjacobse3179,1,0
MARKIPLIER WAS FIRST,@TheNlShadow,2,2
Glad for people like you,@MsLampalampa,1,0
its basically a man in the middle attack,@re1ky,1,0
Brilliant,@swarapawar3903,0,0
Why wait so long to release part two?,@jorns6678,1,0
markiplier predicted this like 4 years ago,@roseth777,0,0
Is Capital One doing the same exact thing?,@shankararhuddlan270,0,0
"My rule of thumb is:<br><br>If one small youtuber talks about something you can check (with a grain of salt) what it&#39;s about.<br><br>If a big youtuber advertises something, think ten times, as it may be shady.<br><br>If several big youtubers advertise something, it&#39;s a scam, no other questions needed. Avoid at all costs.<br><br>If over 10 big youtubers advertise something, don&#39;t even look it up.",@NotCreativeNickname,1,0
"Rule number 1:<br><br>Nothing is free, end of story.",@AylottPeti,2,0
++,@zadam,0,0
Where&#39;s the next part?,@TheDreamLeaf,10,0
"Why does youtube pick and spam, the most intentionally annoying ads? Temu, the 4x shit unoriginal ad money games. Google wants to be so annoying idk why. Tis like, opera/brave browser time......",@lucasdumb4626,0,0
Immagine nord vpn is a fraud,@Chillychilly-qe1dj,1,0
@MegaLag Are you still alive?,@generico896,7,0
Hey its a fellow kiwi,@demods1,0,0
I remember telling my dad and mom about it thank god they didn’t get it,@Shebobomk,0,0
It never actually saved me any money so i uninstalled it very quickly,@detectivewiggles,2,0
Sue them,@paulkeenan3184,3,0
"Markiplier new:<br><a href=""https://www.youtube.com/watch?v=JdMAC61RK7s"">https://youtu.be/JdMAC61RK7s?si=ubUj_3glMbxvjvrN</a>",@ad4m-g,0,0
"Part 2 is way too late, everyone forgot about it already",@MiyazakisPVPexperience,11,2
I tried to download honey once and my dad uninstalled it and told me it was no good. I should always believe my dad about this stuff it seems,@laurencahill1068,0,0
#1 in Buisiness ..... get yourself between the People and the Money <br>Damn smart from honey<br>And how all the &quot; Influencer &quot; crying that they lost Money becuse of their Links been gone ...<br>fuking love it !!!!,@derrawhide,0,0
Thanks!,@SukritBhatnagar,3,0
Why do you think that Honey now has more users than before the scandal news broke? It’s crazy.,@austin.england,0,0
"Glad I never downloaded that app, I just don&#39;t care enough to save a couple cents or dollars on my online purchases.",@braiangularte9315,0,0
"<a href=""https://www.youtube.com/watch?v=vc4yL3YTwWk&amp;t=23"">0:23</a><br>There Was In Fact, A Catch",@bear7098,1,0
damn.,@Avni-fictional,0,0
Do Groupon,@viewsandvalues,0,0
bro has been real quiet....... he said he would be coming with a new video soon......,@saadansari-vi7pt,3,0
"So it&#39;s been 3 weeks, and I still haven&#39;t heard a peep about any class action lawsuits against this.<br><br>Which sends a message - <b>stealing is NOT punished</b><br><br>So, enjoy normalizing theft and fraud!",@ferofax,0,1
I thought everyone knew how this worked already.... I figured that out by the second time I used it.   that was like over a decade ago it feels.   removed it after that and kept It in mind when I saw someone trying to promote it.,@TheJunky228,0,0
toch an doddi,@nagarajdurgam518,0,0
Didnt jive with us is wild. &quot;Jive&quot; they outright stole from you lol,@Aaron-xo7px,0,0
When&#39;s the next video on this?,@joshholland9473,1,0
Markiplier was right!,@JuanPena-d6r,1,0
Oh no Lmg trolls here wow,@mbgk4190,0,0
Good to know,@Xoz-be4xp,0,0
At least Winnie the pooh eats the honey decently....FG,@grouikr7742,0,0
"<a href=""https://www.youtube.com/watch?v=vc4yL3YTwWk&amp;t=777"">12:57</a> they didn&#39;t get way more money out of sponsoring this for sure",@WsciekleMleko,0,0
"Imagine being smart buyer, who doesn&#39;t buy something other youtuber tells him to buy. Then you get money out of honey, and no one loses it.",@WsciekleMleko,0,0
Eh don&#39;t really feel that bad about it. Never buy from affiliate links to begin with because why should creators get commissions. That just promotes bad faith reviews in my opinion.,@prototypep4,0,0
"New flash 90% of YouTubers are scammers .<br><br>Posting videos isn&#39;t a job , kids.<br>Stop listening to social media and influencers.",@nflisrigged1395,0,0
"Nice investigation, you gained another subscriber 👍",@kennethJAO96,0,0
"I tried Honey! And probably others.<br><br>When none of those free installations saved me any money at the point of checkout (almost buying the product, another click or two away), I gave up. &quot;What good is this thing? I thought it could find me saved money anywhere and all the time. Whatever.&quot; I haven&#39;t used anything since. I have, however, gone by my great grandfather&#39;s adage: If you don&#39;t have the cash to purchase something, you can&#39;t afford it. It&#39;s worked wonders for my budget and financial life, online &quot;money savers&quot; be damned.",@francisgoin3112,0,0
@MegaLag can you please make a vid on misplay? I keep seeing all of the ads and I would like to know how they make money,@Destroyar999,0,0
MARK PREDICTED THE FUTURE!!!,@Sakura_Sunz,0,0
"because in the big corporate world all the money is made between the lines, with no transparency to us the consumers. they have no accountability for the responsibility their not lying to us in the first place. <br><br>how dumb are influencers and people who follow them...<br>characterless sheeple. <br>money is the root of all evil. think for your selves for once.",@Mrextravigant,0,0
"Thank you for discovering this big scam, a professional scam company. ❤",@very-frank,0,0
LOL people are collectively dumbasses for money always. But then there are those that fall for it that will stil believe the yare different.... XD XD... XD,@girthakian,0,0
how aren&#39;t you a detective,@suol-a,0,0
Does anybody know when part 2 is going to be released?,@hiddenshadow2105,3,0
They owe all their content creator promoters that money.,@Kankooro,0,0
The browsers need to pull this fraudulent shit off the extension market,@Keithfert490,0,0
I need part two!,@tehfirstjonowano,1,0
"with all this going on in browsers, Chrome had to have known too",@davemichael798,1,0
Imagine this video was sponsored by Honey,@timothyshahbaz4903,0,0
False advertising,@letsRegulateSociopaths,0,0
PooPal,@letsRegulateSociopaths,1,0
"I actually never want to use any of paypals services ever again for this, this is so far beyond the bottom of the barrel scum its indescribable",@DavidSmashGames,0,0
You sound like the Nostalgia Critic.,@ic3mania,0,0
I care if your life isn&#39;t honey after this video 😭📸,@ynycu,0,0
Problem with this series is you should of recorded all the episodes now people have to wait for weeks or even months for next part,@simeondavidjones,0,0
Anything that Mr Beast endorsers is bound to be shady .,@Bebedollie,1,0
When will the next part come out?,@eebtheweeb1419,2,0
Thank god ive always been too lazy to install it,@Rob_FCB,0,0
So theyre giving Coupons and Affliates assumed they wont get Cut? 😂😂😂😂  I mean within 2 Seconds <br><br>Of Course The affiliate will have it removed that&#39;s so easy to see,@areadreamfamily,0,0
"sure.... the &quot;influencers had no idea&quot; funny those that promoted honey are the same that are or were involved in scamming fans, but yeah they had no idea....",@HellSkater19,0,0
"That&#39;s glorious, what a genius scam...",@griffin5734,0,0
Oh yeah also markaplier predicted the honey scam,@JOJOQUEENOFTHENIGHTMAREPUPPIES,0,0
He needs to get a Pulitzer for this.,@YallAintRight,1,0
Another internet scam. What a surprise.,@sandeepsampath1985,0,0
Gotta wonder what scam NordVPN is running,@andrewpye,0,2
"Please More scams on influences, yes less destroy those attention seekers every where.",@ferkeap,1,0
Where did you get this msr gas cartridge light bulb? I would Love One myself!,@hikingbuddy270,0,0
Crazy the money these guys make and still out here trying to scam for more p,@Inmysightsgaming,0,0
"Forgot to say this earlier, if you&#39;re ganna make part 2, you must and I mean must mention Markiplier. Because he predicted the scam way before you started investigating.",@shresthasengupta8984,1,0
hope everyone watches this video stops using this stupid PayPal product,@ABDELRHMANmahmoudd,2,0
I’m glad I’m a bit paranoid and also very lazy my paranoia of there being no such thing as a free lunch was completely right,@Kdog49,1,0
아이고..,@firemanseo,0,0
Wow,@Superman1-2,0,0
when is bro dropping part 2,@9adorechan7,1,0
ugh Mr. Beast is such a garbage person,@Giantcrabz,0,0
Markiplier called it gang!,@Lane_KellerRW24,0,0
the only way to save money is to not spend it,@user-gj1lb6xp3t,0,0
hurry up and release part 2,@bigblackshaq3,2,0
Wow.🤯 Insanely good journalism. Well done. I’m truly floored. 🍯🚫,@ChocolateEClaire16_,0,0
Wow!!,@Clay-mh7kd,0,0
"I&#39;m predicting it. The next thing that&#39;ll get exposed is the multiple vpns that youtubers are always sponsoring like Nord Vpn, Surfshark or any other vpn youtube sponsor for selling your data or something",@KirderkFrog,1,0
Im sharing this video with all my friends! Thanks for this valuable information.,@kryonc.f.9487,0,0
When is part 2 coming up ?,@axel_blaze_csgo,0,0
you just got a sub,@aloharay,0,0
"ive always stayed away from the sus extensions, no matter how smart they seem.<br>password extensions? one after the other they all prove to be hacked or scams.<br>anything that deals with money is most likely a scam, if you are a scammer, ofc the easiest way to scam is by working with money.",@kerz5383,0,0
We should&#39;ve listened to Markiplier,@cindybailey83,0,0
"Let me guess, it is the companies that didnt partner with them",@tksrichy4479,0,0
This is why my cheap ass looks for coupons myself lol,@julianarincon4488,0,0
"Sorry, but after reading this, you won&#39;t be able to unhear the background music.",@Pboy7272,0,1
good deep dive on honey,@pourkin,0,0
"Really enjoyed the beginning of the video, really showed how much Honey has been advertised! It&#39;s scary to think that actual people came up with something as scummy as this, I hate that there are those who don&#39;t have any morals when there is money to be made",@luminemo,0,0
"Influencing:<br>The power to affect, control, or MANIPULATE something or someone; the ability to change the development of FLUCTUATING things such as conduct, THOUGHTS, or DECISIONS.<br>It is a stupid term and so whacky and yet so many hold it as an honorable title lmao. Fools",@harishshaddy,0,0
Are you alive?,@saadmaanshahrier,1,0
There seems to be NO “manifestation/wealth” comments on here. Effective bot-killer and/or moderation!! 🌸☘️,@josiechaney9010,0,0
I PAUSED AND GOT RECOMENDED HOMEY,@n0rmal_men1,0,0
The fines &amp; punishments need to broken down into 3 categories to be effective. <br><br>(1) You have to pay back 100% of the money you stole. <br><br>(2) You have to pay 50% of your gross profits for the year as your fine. <br><br>(3) Your CEO goes to prison for theft. He also forfeits his salary &amp; benefits for the year.,@rtm135,0,0
"hey new sub here , I was wondering when will part 2 drop . thanks , great video , happy new year as well.❤‍🔥❤‍🔥❤‍🔥❤‍🔥❤‍🔥❤‍🔥❤‍🔥❤‍🔥",@africamitchell34,1,0
I&#39;ve never heard of honey until literally just now,@jamalamitchell,0,0
illegal ! they should be sued and pay 90% of their capital,@ghostkee5031,0,0
Commenting for algorithm/ engagement purposes,@JGWC,0,0
"Dont&#39;t you think that the new coupn extention that lmg is prommoting could be his own company .you think it  this way lmg promoted a company for their own  good and later after many years they finds out they have been scammed all these years and still just cut dwon thier parternership. as one of the biggest tech creators the amount which lmg lossed wont be a small amount,but still they dont sue them for rewriting their affiliate link after they found about this ,or informing others about this scam instead, they kept it silent and you too saw one of his emoloyees reply in a way they don&#39;t care that much.but after a few years he comes up with another company saying as a new collab but doing the same job don&#39;t you think if it was a promotion wouldn&#39;t he verify it due to his past experince and cancel the promotion but instead he promoted it again what was the name again &quot;karma&quot; is that name too so random I don&#39;t think so so I  think his now his way of getting the payback ,but by scamming his own followers by himself rather than letting any other company do it",@the_darkseid777,0,1
"Never trust any ads. Never get addicted with discounts. Nothing is cheap/free. You don&#39;t get good deals easily.<br>In the age of technologies, internet, and AI, you&#39;re nothing more than a sheeple ready to be milked anywhere, anytime by greedy corporations. Get used to the 4 points above and you&#39;ll be fine.",@khaiphamba5991,0,0
when part 2?,@littlebluefishy,1,0
There is a saying in my country: if it is too good to be true it probally is,@Battlefieldenjoyer,1,0
Is it a scam when it&#39;s clear how it works? People just don&#39;t think about consequences enough. Most people refuse to think about stuff nor do they want to discuss it.,@Schachtens,1,1
¿para que pones un titulo en español si vas a hablar en ingles?,@OtreborD7,0,1
this is very bad practice by honey and PayPal. they should be fined and need to payback stolen money to people,@nnk3718,0,0
"Dude, PayPal itself has been scamming people for years, I myself had over $2000 stolen from me by PayPal",@VoltageLP,0,0
the fact they got people to use it since 2016 ... ugh,@eduardoflorentino2808,0,0
its called honey?! a very subtle name for a honey trap,@AliSaaim-v3l,0,0
sending you well wishes 💙,@melsyoutube,0,0
"I didn&#39;t even know what was honey in the first place, because i was first introduced to it in the coiny vs coiny debate, but i still didn&#39;t really like them and i knew they would pull smth like this.<br><br><br><br><br><br><b>Markiplier isn&#39;t alone.</b>",@Raphaels_silly_alt,1,0
"This doesn’t end here, the U.S and others get hit by this really hard but Brazil and others don’t have a clue and never will if no one tells them about this",@bruhhhj,0,0
I have the paypal app downloaded and it comes with Paypal Honey extension enabled on my iPhone Safari extension even though I never wanted this “feature”,@doublejay2935,0,0
Bro vanished,@bones5122,2,0
Give markiplayer a reward,@Doodletonestupid,0,0
"So, when is the class action going to be created for the suit?",@darrenwheeler2511,0,0
Influencers have no problem ripping off their viewers by promoting shit they know nothing about for their own benefit. I have no problem saving money at the expense of influencers,@FarmerSchinken,2,0
Its been 3 weeks where is the vid,@01dom,1,0
to be honest idc who will get the commission so its content creator vs honey  and we will get the discount anyway,@turki5528,0,1
Honey is not a scam for the purchaser. I use it all the time and the coupons have saved me hundreds of dollars. One of the biggest savings were on a Swann security system. Then I have redeemed at least $30 of coles supermarket gift cards using the points,@patronza,0,3
"Instead of raising the alarm, LTT chose to remain silent. This is quite telling.",@zj7845,1,1
"3 weeks now , are we geting another part ?",@ROHooligan,3,0
