text,author,likes,replyCount
in the next part will you mention pie there has to be something shady there.,@Potatoriply,0,0
Day 26 of waiting for part 2,@SoloStudiosOfficial,1,0
DAMN,@seanmellyy,0,0
YOOO THE DRAMAA,@seanmellyy,0,0
"In UK I had this extention for over 2 yrs and it never helped me save any money whatsoever, had enough and deltted it 4 months ago",@wrathcaster2555,1,0
Bruh I got an advertisement at the end of the video for a for 60% for codecademy what the heeeeeeeeeeeeeelllllllll 💀💀💀,@oneicatalin9579,0,0
"Influencer commissions are BAD for us consumers, regardless if it’s Honey or whoever! The retailer simply includes this commission into the price WE pay! I could care less if it’s honey or some schmuck influencer! Frack them all!",@letmeehan,1,1
That truly is disgusting,@taylorm7777,0,0
where the hell is the federal trade commission AND the securities comedians,@ernestg.harveyjr7087,0,0
oh thank the lord i figured it was fulla chyt! unbefknleavable poor linus and the millions of others!,@ernestg.harveyjr7087,0,0
These people are gonna claim they got “scammed” they literally force fed this scam to people,@James-p2z1o,0,0
"Lol honey is just using the money they got from sucking the links to pay the big ones. They make their money off small youtubers and use that money to bribe and pay the big ones for publicity. They all knew this but since they make more money from the sponsor ship than from these links anyways, why would they call honey out? So they can help the little ones? 事成之后大网红的钱如数奉还，小网红的钱三七分成。",@whygamewhy,1,0
"I use to wonder how they made any money from it. It seemed like they would loose money there had to be a catch. I didn’t assume scam per say but I did think there had to be something once you install like a free app that had in app purchases. Also, I don’t care if someone is famous or cool that doesn’t make me do something unless I do research first to see if it is best.",@ama1992101,0,0
this is a scam on so many levels. not just scamming affiliates. but just market manipulation with refusing to share certain coupon codes.,@Shrek_Holmes,0,0
"He&#39;s afraid to make more content because he know there will be no more views as high as this, lmao! Milking this video to the max 🥛🐄🍼",@ElfenCried,1,0
"<a href=""https://www.youtube.com/watch?v=vc4yL3YTwWk&amp;t=296"">4:56</a> lvl 99 scam holy shit",@xuburbia3515,0,0
"Owned by Paypal, owned by Ebay, controlled by Vanguard who are Blackrocks only real competitors. Class video, very good!",@freepartytunes,0,0
Does DontPayFull do the same thing as honey?,@hudyUT,0,0
Thank you so much for doing this work! I’m currently broke (old unemployed programmer) but I will remember this and ensure I join your Patreon once my cash is flowing again. This is truly amazing work.,@mikemcaulay9507,2,0
"The YouTube channel Rex Salisbury, only slight modified and lifted the thumbnail artwork from your video.",@waltonchunky904,0,0
"So, what you&#39;re also saying, is that these influencers promote a product of which they have no knowledge at all. They accept the sponsor, get paid, and then the extention pretty much backfires on them for not checking what it does...<br>The irony is hilarious",@outty84,2,1
Honey might have assasinated him.,@Videoforthewin,0,0
any news on the next video? Or is he already missing?,@localhouseplug,0,0
We need a part 2,@CommatheCatboy,2,0
WHERES THE SECOND VIDEO GIMME PART TWOOOO,@nish3603,0,0
are u still alive? making a wellfare check... lol,@wintermutevsneuromancer8299,1,0
Who&#39;s here from Gamers&#39; Nexus :) ?,@jaimelapolitique349,1,0
"&quot;What&#39;s the catch?&quot; <br>&quot;Well, here is the catch&quot;",@Atguest,0,0
Who else is here from Charlie,@Thecrazygamerkid0616,0,0
This video is another example of how journalism has left the news agencies and into the hands of everyday people. Thank you.,@TheWeirdMusic,10,0
"When honey first came out, and everyone I knew started using it, every time I was asked I said “nah, it’s too good to be true.” Every single time. Maybe two weeks ago I finally bit the bullet and downloaded honey because of my favorite YouTubers pushing it. Needless to say it’s gone again LMAO.",@animationtrilogy3407,1,0
"Markiplier said they were a scam YEARS ago, like in 2020 or 2019!!",@kayleejeffrey4104,0,0
<b>Steve Burke sent me. Who is not surprised to see Linus-the-Scumbag prominently shown and mentioned in this expose? Cheers!</b>,@blackrifle6736,0,0
"What about the codes that pop in Honey when clicking influencer&#39;s affiliate and code says &quot;Meggie30&quot; or &quot;insert_influencer_name20&quot;? I&#39;ve came across such and now I wonder if this is even more deceiving practice, because that influencer actually receives nothing. I as a consumer aware of affiliates am thinking that she/he does get commission. Wow, this is bad.",@barbaraaguirre9831,0,0
"Most things on internet couldn’t happen in real life, ever. Don’t get me started on fake pay for clicks in advertising. Facebook, x, instagram, could never behave how they do irl. Fraud, bans, cancel accounts for no reason, remove your followers, shadow ban. They’re corrupt, no one notices?",@Prin_Cess_007,0,0
Where the fuck is the next part,@thetruegraham,6,0
"This was fascinating in itself, but it was also illuminating in showing what a scuzzy outfit LMG is. Linus knew what was going on years ago and let his subscribers continue to to get ripped off because his position is &quot;Not my problem&quot;.",@gooner9038,0,0
"All influencers? No, not this guy in 2019! <a href=""https://www.youtube.com/live/tFQ1KIfIMmQ?t=2072s"">https://www.youtube.com/live/tFQ1KIfIMmQ?t=2072s</a>",@Joe-n6h2l,1,0
its sound CRIMINAL to me.,@ghostgutarist5234,0,0
"I didn’t understand how to get it to work for some reason since I always paid with my phone, I’m glad I didn’t use it",@Itsanope,0,0
"Linus Tech Tips needs to take responsibility for not saying anything, THEN partnering with another company that does the same thing.",@gamerhex7335,1,0
Anybody that believed there was no catch for using Honey should stop using the internet while they&#39;re ahead.,@audiogarden21,0,0
Shocking that LMG and MrBeast could be in the top three promoting this 🤔,@theboomfish,0,0
"Thanks Steve, Legal Eagle and MegaLag",@DarkAge69,1,0
Dude unleashed the flood gates.,@MiGujack3,0,0
It would be funny if this video is sponsored by honey😂😂😂,@balls-nz4cs,0,0
"When you see a influencer plugging a dodgy browser which when you go to some other website try to automatically install that browser on your computer you just know you should be installing it NOT !! , there is a lot of influencers on YouTube which have already sold their soul to the devil for cash .",@peteradshead2383,0,0
"Linus did not start the fire, he just left the building and never pulled the fire alarm. This is what he is guilty of.  This is who he is.",@percival23,1,0
"Uhhh dude, cliff hanger? Is there going to be more?",@RElizabeth,1,0
아이고~,@금실재봉사,0,0
"all this sounds incredibly illegal,  they should compensate every person whose link got poached.",@buibuiopolismayor7329,0,0
Hey uh megalag can you please tell me some thing i have a small youtube channel and on my most recent video somebody commented that i was doing fantastic but they said how to transfer okx to usdt or somth to binance with a wallet seed please tell me what is going on cause i play games and i dont know about wallets please tell me if this is a scam or not cause idk and i have delletd a comment Please notify me,@realjerryplush,0,0
I’d rather plant trees when I browse the net. Ecosia,@lextron-audio,0,0
It&#39;s wild that jartelt from the Y Combinator post first mentioned this 5 YEARS AGO! And he had read it somewhere before that too. Geez...,@SpaceTed,0,0
As soon as I heard of Honey I knew they would be selling your buying data but never knew it was this bad,@hansjongenburger,0,0
Oh no someone scamming influencers,@isthisreva7878,0,0
"I had honey, but it never found codes, so I never used it XD",@Jackty89,0,0
This video reminds me of when Drew Gooden said that his Honey awoke from a three year coma when he was buying random things on the internet.,@osore_rareru,0,0
Bro went missing,@sam-sunghater,2,0
When is part 2?,@2301senna,2,0
"I don&#39;t believe Mr. Beast is a bad guy, after all he&#39;s done for the disable &amp; poor country when many government fail to do, and Mr. Beast getting money in the process is acceptable to me.",@therecogniser2122,0,0
When is part 2 releasing,@sandeepkark,2,0
bro whens the next video??,@keeshectors8261,2,0
even i&#39;m from Chile... i&#39;ve missed out the honey sponsoring thranks to sponsorblock!,@FaiTCRaH,0,0
I shoulda listened to Markiplier,@uberrr-su5vq,0,0
I feel like this guy really missed a trick by splitting these videos up. I feel like the situation has sort of cannibalised itself now,@tobesxd,1,0
What&#39;s funny AF is Linus ALWAYS be commenting on anyone&#39;s video if it mentions him or his products.  Where&#39;s he now?  Where&#39;s he now??,@Ske-bebe,1,0
Great Part 1. But where&#39;s Part 2? Is there a Part 2? Is Part 2 a scam too?,@SuckaFreeBoss,3,1
Honey is like Robin Hood except if Robin Hood kept 99.99999999% of his profits and also paid the rich people off himself.,@username5155,3,0
I wanna know your thoughts on pawns app. Its a growing community allowing individuals to make a passive income by taking surveys or sharing unused internet bandwith( I dont recommend doing this it seems too much sketchy). Personally im doing surveys and some tasks regarding playing games. I really liked your research on honeygain. Would love to hear your thoughts. Thanks!,@Inocstaysalive,1,0
Megalag we&#39;re worried--is pt. 2 of the video coming out? Are you alive??,@tjovaughn,5,0
There&#39;s little logic in your claim this sounds quite normal and understandable. It&#39;s only mildly problematic if you actually could prove that they intentionally come up on sites that they know they don&#39;t have a coupon at. It&#39;s kinda weird how YouTubers try to make such a big issue out of a small strategic move...,@hosseinrahimi6045,1,0
Deleted,@slutica,0,0
Markiplier knew it all along,@mggemr1754,0,0
"Damn, they got us",@wirosableng25,0,0
"They wanted Honey, they got shown the <b>Moon</b> 😂😂",@fridaycaliforniaa236,1,0
I removed Honey after using it for a short time because it did interfere with my purchase. I considered it full of bugs.,@barrymerritt3727,0,0
Bureau of Consumer Relations needs to take a hold of this one.,@ExpressBrick,0,0
"First click is actually the easiest of the three.  It requires NO additional code.  Last click is a SCAM and requires additional code.  So, it was not implemented because it is the easiest as you mention.  It was implemented to steal money from the rightful recipient.",@michealmorrow1481,0,0
Wefere se robó este video,@yasserzum,0,0
Boycott Paypal,@ExpressBrick,0,0
"<a href=""https://www.youtube.com/watch?v=vc4yL3YTwWk&amp;t=293"">4:53</a> the gasp I just let out no way 😭",@Amberrx2024,1,0
Can&#39;t wait to see this class action case,@phreakhead,0,0
They call him MegaLag because there&#39;s a mega lag between uploads,@DanielleAlek,7,3
Anyone taking advice from influencers is the real fool here.,@neptunesblood,0,0
Does Capital One rewards do the same?,@bradleyrowbottom5892,0,0
"Reading these comments, it&#39;s funny how all these Gen Z idiots thinks their dads are smart because they figured out that Honey is a scam. Well, they&#39;re not smart, necessarily, they&#39;re just from a generation that nominally understands critical thinking but also understands that if they don&#39;t understand how a for-profit business is making money, then the way they&#39;re doing it is either illegal, or they&#39;re not making money. Period.",@John-tr5hn,0,0
"Affiliate commissions are scams in the first place, so why should I care? It&#39;s like getting upset that a big drug cartel extorted smaller drug cartels.",@John-tr5hn,0,0
He never explained what the last missing thing was that he figured out? Why Honey did sometimes find good deals and sometimes didn&#39;t steal the last click attribution?,@tailee3028,0,0
5 hours ago: GamersNexus Files New Lawsuit Against PayPal &amp; Honey,@MrAgmoore,2,0
I would imagine companies know who is getting the most commission. Surprised it wasn’t a red flag Honey would have been so high up.,@brandonguild1666,0,0
You just wake up the whole internet. Good Job!,@NGUNOW,0,0
So what&#39;s the catch.<br>What&#39;s free can truly be expensive.... especially when for-profit company pay 4 billion to acquire it. (money/honey must come from somewhere),@michaelwang6125,0,0
Does Elon still own PayPal,@brianross9235,0,1
It seems that Rakuten also offers a browser extension. Their business model is to take the commission and give the customer a part of that commission.,@greggleswong,0,0
"How can you guys be taken seriously, like, ever again? Y&#39;all are just internet grifters lol",@adamross4295,0,0
I very rarely buy anything that a YouTuber is sponsored by. 99% of anything sponsored sucks. There&#39;s a reason why so many YouTubers have the exact same sponsors.,@evolancer211,0,0
"Has anyone reported the Honey browser extensions Apps to Firefox Browser Add-Ons, Chrome Web Store, Google Play (for Android phones), Edge Add-Ons (for Microsoft Edge), and Apple&#39;s App Store (for iOS devices) to have them taken down? These allegations make it clear that these browser extensions and apps are Trojan horses and are malware.",@jnvivian,1,0
"Ok Fine, I take back what I said........I no longer mind waiting half a year for your quality content",@psps6623,1,0
Wow you got more views then followers 🎉🎉,@bn5911,0,0
OMG,@avior_trumpet,0,0
GN sent me. Great reporting!,@vnineb,1,0
This seems illegal,@lydia722,0,0
"My father once told me: Don&#39;t trust stuff that is advertised as free, cause you don&#39;t know the price.<br>I honestly hadn&#39;t thought about it until I saw your video, and I&#39;m glad I did. <br><br>Keep up the good work. I&#39;m looking forward to part 2.<br><br>I bet Honey pressured stores into paying them by threatening to give customers the really good deals, like 60% or so, and then only giving the smaller deals if the stores paid. Am I right?",@FowlManor,0,0
Honey just sounds like a metaphor letting all of the influencers AA the bees to do all the work getting customers then they just STEAL the honey*,@madyp.8978,0,0
"YouTubers that were scammed by Honey and ended their partnerships with the sca-- I mean, the &quot;service&quot; could have openly said what was going on and asked followers to not use the extension anymore, at least with their affiliate links?<br>I&#39;m asking because there&#39;s always a chance corporate lawyers could show up at their homes with C&amp;D orders for them to stop defaming the brand or something among those lines.",@StarFoxZX315,0,0
"Congrats Megalag, you’ve unleashed the dogs of Legal Eagle and Gamersnexus, Honey’s gotta be having intense conversations with lawyers right now 😅",@ampinstein,2,0
"If you are brain dead and believe anything paid manipulators say, you deserve to be ripped off. How dumb are people?",@corey8677,0,0
I dont get why lying and scamming is such a big deal. The US elected a president who built an entire life on those concepts. Elon musk became the richest dude doing the same thing,@Rocksteady8519,0,1
Influencers should be held responsible as well!,@Matt-YT,1,0
"I am glad LMG ended the sponsorship, but I wish they were more public with this issue like you said.",@morpheus_9,3,0
It never found me good coupons codes so I got rid of it. I use Capital One Shopping instead because it has up to 70% cash back.,@MichaelAllRekt,0,0
"It&#39;s insane how this went unnoticed for so long, and paypal is supporting this!",@ajnabee01,3,0
Guys make this go viral,@irenekavanagh3943,1,2
Thanks for your work. It&#39;s really a shame LTT didn&#39;t make such a video when they found out.,@stivnov,48,0
i was skeptical of the ad from the start,@CevioEvion,0,0
hurry tf up with part 2,@TheOfficialIndustrialStatic69,0,1
KUDOS👏,@mohamednor4528,0,0
Can you do on Amazon &#39;dynamic&#39; pricing?,@avieshek,0,0
And no one went to jail... the end,@TroyLeahy,1,0
Excellent... I liked your video 9 times ...👍👍 .. good work keep it up 👍,@faisal163,0,0
❤❤❤❤❤❤ ✨✨✨✨✨ Good Idea 👍👍👍👍,@faisal163,0,0
"It makes perfect sense that PayPal, the app that unified the most evil people with money, is behind this",@yobamos2158,1,1
"Please, investigate all Chromium browsers from Brave to Opera GX… reminds me of UC Browser.",@avieshek,2,0
"I stopped using honey some time ago. I didn&#39;t know they were doing any shady stuff, I just hated that I had honey installed for about a year and not once did it ever find any coupons. So I got rid of it. Why keep a useless app on my computer.",@wolffe6044,1,0
This was a great video. I never had the honey extension but I’m closing my PayPal account because of this. Absolutely disgusting business model,@ufcgooch,13,0
Sounds like something Elon Musk would do.,@Choc_Chilla,3,1
"Congrats bro, you caused a revolt",@naxwit,2,0
"May I ask about <a href=""https://www.youtube.com/watch?v=vc4yL3YTwWk&amp;t=693"">11:33</a> Why the date of purchase is from 2021? Does that mean that the whole investigation took more than 3 years ?",@mikas3322,0,0
"Free money indeed, but not for us",@JTanis,1,0
This is so deeply unsettling and unethical. I hope someone takes them to task about this.,@amandah2866,1,0
"people saying they &quot;automatically assumed this is a scam&quot; are worse liars than honey 😂😂 this never did anything but work for me when i used it, this is such a weird development",@trova4725,1,0
아이고...,@dyk-c1y,3,3
Thats why i never trusted honey app seem like a scam from the start,@Zentry06,0,0
Love your content. Thank you.,@alinasimon6399,1,0
RESPECT!!!,@vineethvijay777,1,0
"Question: there&#39;s this app in the UK called Borrowmydoggy, and it has a browser extension that closely resembles Honey, does it also do the same nefarious thing?",@luhannnn,0,0
Markiplier was right about Honey being a scam,@DDDRIFTER1,1,0
I figured out by myself it would be some kind of scam when MrBeast promoted it but I couldn&#39;t understand how they made money with their business model. So I ended up never downloading Honey cause it seemed phishy😒,@top-g-youtuber,2,0
So is this guy still alive or what?,@Travigameis,0,0
"“You’re gonna pay, pal”",@RaNdOm3.1415,2,0
I wonder is Capitol One doing the same thing?,@CarlosPickens,0,0
아이고...,@Yoon10138,1,0
Come on maaan! You have to publish part 2 &amp; 3 before you &quot;go missing&quot; 👀🫣,@adamaustvold,1,0
"<a href=""https://www.youtube.com/watch?v=vc4yL3YTwWk&amp;t=1266"">21:06</a> when h3h3 was funny 😢",@davidasdasd4666,0,0
When is the part 2?,@maksym.koshovyi,1,0
This is why I skip ads,@DARKSTAR1422,1,0
where&#39;s part 2 m8?,@erebus79,1,0
"Absolute DISGUSTING behaviour from Honey. <br><br><br><br><br>Also, Not really related but I found out about Mr Beast from the honey ads",@PeepsiclesXD,1,0
Next time they check the products the sponsor given they don&#39;t seem to have problems sharing obvious scams.,@iMorands,1,0
I saw someone comment that honey was spyware years ago and I never touched it since lol. <br><br>Thank you random commenter guy 🫡,@collarbones4511,1,0
"PLEASE do opera gx next, that is another big scam that you need to cover",@rusdhyantoanggoro9807,3,0
I watch YouTube from a TV,@hayabusahaizuka8835,0,0
"I just thought it was just harvesting your data to sell to advertisers and disliked it on that basis- who knew it was so much worse! I&#39;m wary of free things for a reason: If you aren&#39;t the customer, you are the product! but nowadays you can even pay or be paid to be used in a scam on yourself + a different person. Incredible multitasking there by Honey.",@sugar3155,0,0
"I just re-watched this because it was so good, and I totally forgot about the ending where there&#39;s actually more bologna that&#39;s going on",@chucklemon70,1,1
"What’s funny is there are stories and websites claiming what you got “wrong” about the whole thing. Lol sorry you douchebags, call it business all you want but I’ll never go near honey you fking clowns.  💯 scam and they’re still trying to spin it.",@whiskeybuddha1995,0,0
Part 2?!?,@Johndoe-pf4hh,2,0
"Be a smart shopper: don&#39;t by anything that&#39;s being promoted by influencers. Don&#39;t by any products that heavily relies on influencers. When there are multi-layers of middlemen, you are not getting the deal. Use ad blockers and don&#39;t install any other extensions. Oh, don&#39;t buy anything from scalpers as well. Just find discounts from normal/regular sales events.",@felizkk,0,0
When is Part 2!!,@derbart07,3,0
"I wonder if all those  influencers  knew that it was fake<br><br>If they know, they would be getting paid to talk about it to there viewers and not tell anyone it was a scam",@Capyslay69420,0,0
Based Honey scamming cancerous e-celeb “influencers”.,@coreytrevor3599,0,0
Miss Beast is beyond cringe.,@TheIrishAmish,1,0
Sounds criminal to me. Thanks for the video.,@traviswyly1187,1,0
"I feel that people will never be able to understand there is no free money, and there is nothing for free",@Betonoszlop,1,0
Subscribed!,@arts.4956,1,0
I used honey of a few purchases and got some good deals.  Got $32 off of a name brand gaming headset!<br><br>Also….i didn’t need an influencer to get me to use Honey.  I used it myself.  So…who got scammed here?,@kevinbernatek7875,0,0
Honey the spyware lol,@anonimofied,0,0
Love the fact that content creators screwed themselves.,@sifat9667,1,0
WHEN IS PART 2,@Daniela-pn8sq,3,0
Sweet,@AchillesAcosta,0,0
That’s insane! Time to do a class action lawsuit!,@nikole921,0,0
CANT WAIT FOR PART 2,@RossHasAdrone,1,0
"Im interested in if other coupon browser extensions also are fraudulent: Cently, Rakuten, Pie...should we use these?",@ScottZylstrathegoat,1,0
Yikes. I hope someone picks up this for a lawsuit.,@moonbasket,0,1
"And that&#39;s why I never trusted it. If something sounds too good to be true, it isn&#39;t, that&#39;s always a good rule of thumb",@VictorDeveze,0,0
A mexican chanel steal this video. Name? Wefere News,@Dangell_Perseo,1,0
"Ermm, when is part 2 out then? It&#39;s been weeks 😅",@itsi3187,0,0
"n December 2019, shortly after PayPal&#39;s acquisition of Honey, Amazon warned users that the extension posed a security risk and advised uninstalling it.",@jonahfalcon1970,0,0
WOOOOOW,@jaywithwhiskey,0,0
"LTT distributed a scam, noticed the scam and didn&#39;t inform anyone who installed that scam - says it all",@kanaye3561,2,0
"This isn&#39;t about millions, it&#39;s about more than that.",@Wizzalion,0,0
I knew there was reason I couldn’t trust that dancing coin.,@NotAGepard,0,0
my man. liked and subbed. keep up the giving a shit!,@lukew7001,0,1
You gained half a million subscribers on this work alone. Good job and congrats!,@Yrgen2,0,0
Thanks,@abigalcarmi6128,2,0
Par for the course for Paypal and LMG.  Further reason to steer clear of both.,@BryanBagehi,0,0
pretty much why i dont listen to anyone selling me items.  its amazing to me that people care what an &quot;influencer&quot; or youtuber promotes. paypal is a trashy company anyway.  never use em,@tankimus,0,0
"impressive work. i assumed that their profits came from selling our data, and that their consistent failure to find coupon codes was just them being a crappy program. <br><br>i used to have it years ago, and it used to actually find coupons. but it reached a point where the only coupons were honey discounts, and they always blew chunks. it was never like, a bogo deal, it was always like 5% off or something lol. then it got even more useless: it would <i>find</i> a discount, but tell me my purchase didn&#39;t qualify. you know, you have to buy $x of a certain brand, or your total has to be at least $y. i remember i would say out loud, &quot;then why did you bother showing it to me?&quot; lol <br><br>and finally it stopped finding anything at all. i didn&#39;t bother installing it again when i had to get a new laptop. <br><br>i&#39;ll admit i&#39;m a little surprised that it was deliberate, planned, fraudulent activity, just because of how brazen they are about it. you&#39;d expect them to pretend it was an accident in case they got caught.",@zubetp,0,0
"And this is good example of why people need to stop worshipping celebrities. Will Ferrell just did a huge ad campaign with PayPal, probably knowing it’s an unethical company and shady, while proclaiming to be a progressive.",@Amanda-ee8oh,0,0
"<a href=""https://www.youtube.com/watch?v=vc4yL3YTwWk&amp;t=711"">11:51</a> “For you ladies out there”<br>Why don’t need casual sexism here? More people than women buy clothes online.",@parmesanzero7678,0,0
Cant wait any longer! Episode 2 when :o :o,@LouisNp,1,0
<b>surprised pikachu face</b><br><br>Seriously… did anyone not figure out that something so massively pushed and so seemingly innocuous was an obvious scam?,@parmesanzero7678,0,0
Gripping T.V. Great work. Thanx 👍,@noncompliant1369,0,0
So……. Where is part 2?,@DSYankeesFan,5,0
"Yo, seeing jimmy’s friend as a guy feel awkward. Seeing any trans person pre transitioning is lowkey odd to me, now that I think about it. <br><br>Cause like, in real life you gotta be (best words I could think of atm) “up to date” to not be a bigot. But online, where life isn’t real, yet it’s where they do most of their living, you come across the befores and afters of (all types of) people so commonly. It’s acceptable to just interact with both lives and you won’t be a bigot.",@ember3117,1,0
This is a perfect example for why sponsorblock is the goat,@jminkvihubyb,0,0
