text,author,likes,replyCount
OMGosh...... WOW,@carlosherrera2702,0,0
I feel like this isn&#39;t the only company either. Norton VPN has a feature similar to honey that does the same thing. It opens and closes a cookie thingy as well. Might be worth looking into as well. Or I might just be going insane LOL.,@BananaManzRonnie,0,0
Where’s part 2 at?,@jalenjohnson1662,7,0
"Its so deceiving to the creators we like and got convinced to buy thr products be ause of them. Yep, they should be sued ti the point they get bankrupt. Great video and coverage overall. Thankfully, legal eagle filed a lawsuit to stop all this.",@lovedrecluse,0,0
So when’s part 2 coming out?,@kensaaku,8,0
"Used it, now with this insight, it is deleted. Good report!.",@javalexlanopen4686,0,0
@hopescope @HangWithHopescope you need to watch this,@k_lynn_dewitt,0,0
"The main reason i didn&#39;t download honey was because I always wondered how they actually profited and made money, and no one does nothing for free.",@ChigozieNwafor-u4x,0,0
Is @MegaLag okay?,@ThePeraltaJake,2,0
this is honestly the most entertaining youtube topic i&#39;ve seen in a while,@hanjinjja,3,0
My dad once told me that &quot;any product that is heavily advertised is so becasue its not good enough to sell on its own merits&quot;. <br>So any time i see many influencers or creators shilling something i know to stay away,@SicariiD,2,1
The time my laziness actually is useful,@Kammi38,0,0
"I think making this so focused on youtubers actually misses a huge part of what makes this so scummy. <br><br>Youtubers drive a tiny proportion of traffic to merchant sites in comparison to everything else. What about the commissions that merchants (the company who you&#39;re buying from) had to pay out to Honey when they really hadn&#39;t referred users at all, nobody had. Just by simply having an affiliate program, they were paying commission on ALL SALES with honey present regardless of if there even was an existing referrer - so that would include sales from just googling them, responding to a tv ad, your friend sending you there. <br><br>This has been attempted many times before by lots of voucher code companies and the merchants can simply ban the affiliate (in this case honey) for breaking their ts &amp; cs - why didn&#39;t they just do that? <br><br>Affiliate marketing reporting is traditionally pretty opaque and often on the client side it&#39;s managed by a junior member of staff, so much commission fraud takes place day in day out that it&#39;s great to see real focus on the morality of these programs.",@saysomestuff,2,4
&quot;I feel like there will be this big conspirancy of honey&quot;<br><br><br><br><br><br><br><br><br><br><br>- BIG BRAIN MARK 🧠,@imgoodkinda,1,0
Oh boy I can’t wait to get my 20$ from the lawsuit in 2032!,@FilthySkinBag,0,0
"we had a type of this scam in Russia. an extension that promised you access to great cashback from partners if you pay for subscription. except &quot;partners&quot; were companies with pre-existing cashback programs, and this scam app took most of cashback that would&#39;ve gone to consumers and gave scraps to those who paid for this subscription",@suojelijatar,0,0
The explosion of this video is crazy. Love how everyone&#39;s talking about you now MegaLag,@RetroSam89,0,0
I thought it was just spyware lol,@stuffing09,0,0
Anyone else feel like this guy would fit right in with The Chasers on The Checkout?,@MetalicKat,0,0
The least scummy YouTube sponsor unironically turned out to be Raid Shadow Legends. Yeah it&#39;s a crappy gacha game but they&#39;re upfront about it.,@giantWario,3,0
maan I can&#39;t want to see the next parts of this!!!!!,@TchSktch,1,0
Hello 🎉,@NIGHTLIVE444,0,0
"No wonder it&#39;s called honey. It&#39;s sweet at first but it&#39;s really, really sticky.",@Speedy-Aussie,3,1
You&#39;re a fan of Linus? He&#39;s as corrupt as they come.,@Atom.Storm.,1,0
Based honey for scamming fraudster youtubers like MrBeast,@person-jw7vb,2,0
"It&#39;s a classic &quot;too good to be true&quot; type situation. I never got it. Because it HAD to have some downside. How does the company make money? They don&#39;t tell you? Well, then it must be shady as hell.  No thanks.",@FunnCubes,0,0
&quot;Free browser extention&quot; would be the ultimate knock out argument for me in the first place...,@dr.sommercamp3435,2,0
I don&#39;t understand why humans still trust each other.  Jesus - try a little pattern recognition! People will only ever actively be shit to each other.  Stop letting them do it to you. <b>smh</b>,@psifiusc,0,0
YuB was in this?!,@simondezombie9001,0,0
dam,@theentrepreneursedge5853,0,0
I KNEW IT!!!!!,@ironuzumakiplays,0,0
Was this guy zucked? Where are the follow ups?,@adonaros,1,1
@weferenews literally stole your video but on Spanish and he used the same content you did without any credit,@richardren100,1,0
This kind of scam is quite breathtaking in its insidiousness.,@geinikan1kan,0,0
Its been 3 weeks wheres part 2,@strain69,7,0
"This is really great work to document the scam in detail but I am very surprised so many people fell for it. It was an obvious shady operation from the start. Nothing about the company seemed legit in the least. People believe what they wanna believe, I guess.",@danielandrewgrant,0,0
My dad the day i wanted to download it in 2017 asked me &quot;Where do they get their money? You need to ask that question.&quot; Shame hes not here to see he was right.,@thatonerandominternetdingu736,0,1
Did honey pay the influencer at any point?,@Toronto1111,0,0
That flipped Yamaha HS7 at the background just kills my OCD stability,@Satirefields,0,0
macdoesit is going THROUGH it right now lol,@norberto05121964,0,0
"now, we need an investigation on pie adblocker.",@eclipse-3812,0,0
Cool,@AllTales2025,0,0
Is my capital one shopping app doing the same thing? 🤔,@carissamessina1908,1,0
I&#39;m breakin out my &quot;False Advertising Lawsuit&quot; - Suit,@RobbCochran-l2u,0,0
"They also use &quot;Crypto&quot; to scam people by tricking them that they&#39;re Buying Crypto, but they&#39;re NOT, They only hold a Stake in SOME crypto... It&#39;s Complicated... but they make sure they FUCK you, you Always loose $20 and you NEVER get to send your Crypto to your EXTERNAL WALLET, No Matter WHAT... check into it. It&#39;s FRAUD",@RobbCochran-l2u,0,0
Boycot PayPal,@RobbCochran-l2u,2,0
OOOhhhhhh That&#39;s HUGELY Illegal,@RobbCochran-l2u,0,0
We are dying here. When are you gonna release part 2????,@multiversomental6893,2,0
LMG waned a bigger cut  they happy with them Fu**ing over everyone else,@bachelorgamer8001,1,0
This a certified hood classic now,@gtanarutogamingsmodsshowca5965,0,0
"<b>News:</b> A creator of Honey was recently accused of using GPL-licensed code in one of their other extensions without adhering to the terms of the license. To clarify, the GPL (General Public License) requires that any software using GPL-licensed code must also be licensed under the GPL. This ensures that the benefits of open-source contributions are shared with the community, fostering transparency and collaboration.<br><br>As a developer, I find this particularly egregious. Violating a GPL license is not just a breach of legal obligations—it&#39;s also a serious ethical issue within the development community. Misusing open-source code without proper attribution and licensing undermines the trust and principles that make open source viable. It&#39;s one of the most frowned-upon actions in software development and is widely regarded as theft of intellectual property.",@TroubledTrooper,2,0
"I ended up deleting honey for different reasons:<br>- barely ever got any coupons or never worked, but kept it going for the times it worked. I use safari, and I dont think I’ve ever noticed a tab open and close in the bg<br>- memory hog!!! it occupied over 500mb of my ram and at times it was the largest process on my Mac. This did it for me, <br><br>then shortly I see these videos lol.",@KarthikeyanDuraivel,0,0
"<a href=""https://www.youtube.com/watch?v=6WqN9GkgykY"">https://youtu.be/6WqN9GkgykY?si=tDemVNJEH8I8jTQo</a><br><br>Lol apparently Honey Sponsored an article to defend them",@marlonb.4017,0,0
I knew it,@marek.nlmedia,0,0
This always sounded too good to be true so IMO the destruction of critical thinking is to blame.,@Therese504,0,0
And they called Markiplier a madman and he was RIGHT.,@Vyntage-ZT,0,0
Who else is here after the yubs video?,@LN_and_darkdeception_fan,0,0
nothing is free unless u steal it. when will people realize this???,@okdok3742,0,0
My man if you don&#39;t release part 2 soon.......,@AdamLH96,1,0
"You are a Legend. Amazing work, keep it up!!!!",@davidholler981,0,0
"lololol, i didnt even know this was a thing. i must be doing something right.",@okdok3742,0,0
🙃Who did we set up for here?,@KakaKada-k6y,0,0
@MegaLag you should try the way back Machine,@Helloyoutubers55.,0,0
Where is part 2?.😢,@mariliam.2800,1,0
So the content creators are finally getting bit by the scams they advertise for😂😂😂,@stonedsasquatch,0,0
"Its not that they even knowed ,So im not blaming anyone but honey",@Sofatofa,0,0
I found a loophole. It might help. resetting the link. And then you still got the deal like? Is that way to get around it?,@DrakeKing-s8g,0,2
mark was right,@Bigmacburgur123,0,0
Honey is shady but then also are all these &quot;influencers&quot;.  They&#39;re all scamming you to some degree.,@ASpinnerASpinner,1,0
"After feebay took over handling the payment system paypal lost almost all income and needed a way to replace that so like almost all financial institutions they just decided to steal it. Allegedly, IMHO",@bobhoward6676,0,0
This video shows how so called influencers promotes things without doing any research just for $,@Crashed-yt,1,0
i had this and immediately uninstalled... thank you. it doing the scammy behavior is no bueno,@fearmyspork3450,1,0
"This is new. Usually the viewers/fans were the ones that are scammed, like that established titles or something a certain paul brother would do.",@StepticalFish,0,0
Isn&#39;t Pie made by the same company?,@darkfairy9240,0,0
First time I hear &quot; Honey &quot; .<br>God I love myself 💕,@НиколайГанев-с6е,0,0
Dayum even Moist Cr1tikal fell for it,@OrionWaltz,0,0
Lol its only something big because youtubers got messed over it. The whole site is ridiculous. Sheeple.,@ThenycspideyParker3837,0,0
You didn&#39;t mention Markiplier! Markiplier predicted it.,@Heroas_Hamseros,1,1
So how is Honey allowed to operate? Why are they not punished yet?,@politicallyincorrect2564,1,0
"None of you &quot;creators&quot; actually used Honey before you guys recommended it to us, just like you probably haven&#39;t used Panels.<br>The only reason for you guys to recommend this dodgy app is due to their big sponsorship (money).<br>I&#39;m happy to keep Honey extension to keep on ripping you creators off... LOL (*troll face)",@gninuy,0,0
No matter how immoral this is. You really have to give props to the genius who made the idea. Disgusting scam.,@head6025,1,0
Anyone noticed honey is no longer in google web store? Not is it just me?,@muhtasimmustafiz7162,0,2
Disgusting company. Hope Honey and similar scammy companies get eradicated.<br>Got to be said though that influencers should be a bit more responsible when promoting stuff. Why say it’s the best coupon saving when it clearly is not?  Did you actually test it? I find that a shady practice too.,@KateSmith-r2d,3,0
You reckon that LMG got paid hush money?<br>Might explain their satisfied quietude.,@UsualYaddaYadda,0,0
"TBH, I was 100% expecting a outing of Honey at some point. I never used the browser, but for some reason the ads made me get suspicious of it so I never downloaded it. I literally agreed with Markiplier a few years ago when he said he distrusted Honey, because it felt too good to be true.",@Chibi_Corbie,2,0
Are the speakers upside down intentionally?,@Greggreggson,1,0
"nice video, honey cringe 👎👎👎",@GambinoTheGoat,1,0
"This is why i don’t trust anything that gives free money, I swear pie is gonna turn out to be a scam or something- just probably not as bad as honey",@KIT-K4T00,4,0
Dude... put the fries at the bang,@Obviu_77,1,0
I am glad that I am lazy to click on ad,@cosmic1426,1,0
"This is why I&#39;m so glad we live in a country with uncensored press. Honey, being owned by PayPal, could&#39;ve bought off some politician and gotten this shut down. <br>I&#39;m also glad for this guy in particular. Thanks for doing all this research man! Good on you, and keep going!",@LukeThorstad,7,2
"Hello I am a Big fan.. Can you please make a video on olympic trade , expert options and other trading apps if they are scam or genuine.",@ZeenrialorReacts,1,0
"honey never found me any codes, so i stopped using it. now i know why.",@Aveysaur,0,0
Thank god I didn&#39;t install Honey. It was too good to be true.,@itshatami,1,0
Proud to say I never used it.,@gordonhodgson8403,1,0